bank,qtd_noticias_recentes,indice_bcb,total_clientes,recl_procedentes,total_respondidas,principal_motivo,periodo,resumo_insight_ia
Itaú,222,34.12,100863694.0,361.0,27703.0,Não informado no período,1ºT/2026,"🔹 O Itaú anunciou o fim do cartão Samsung Itaú, que será encerrado em 1º de agosto de 2026, com a migração automática de todos os clientes para o Itaú Platinum. Essa decisão parece ser parte de uma estratégia de simplificação e consolidação de produtos, visando melhorar a experiência do cliente e otimizar os serviços oferecidos. A parceria com a Samsung foi um movimento inovador na época de seu lançamento, mas agora o banco parece estar reavaliando suas ofertas de cartões de crédito, possivelmente em resposta às mudanças no mercado e nas preferências dos consumidores.


🔹 O banco Itaú enfrenta desafios relacionados à sua reputação devido a problemas operacionais, como a instabilidade no sistema que afetou o acesso dos clientes ao aplicativo e serviços online. Embora o Itaú tenha anunciado que a instabilidade foi resolvida, esses incidentes podem afetar a confiança dos clientes e a percepção geral da qualidade dos serviços do banco. Além disso, a criação de um site como o Factópoles para se defender de críticas e notícias negativas, como as publicadas pelo portal Metrópoles, sugere que o banco está ativamente trabalhando para mitigar danos à sua reputação e manter uma imagem positiva.


🔹 O Itaú também está enfrentando questões relacionadas a dívidas e sanções, sendo apontado como o maior devedor de São Paulo após um golpe de R$ 20 bilhões. Essa situação levou a uma CPI (Comissão Parlamentar de Inquérito) que mira o banco devido a essa dívida bilionária. Além disso, a condição de maior devedor pode ter implicações significativas para a reputação do banco e sua relação com os clientes e investidores, especialmente se considerarmos a percepção de responsabilidade fiscal e gestão de riscos."
Bradesco,73,48.92,110328071.0,348.0,35387.0,Não informado no período,1ºT/2026,"🔹 O Banco Bradesco está se movendo em direção a parcerias estratégicas com prefeituras municipais, como a de Palmeira dos Índios, onde a prefeita Tia Júlia se reuniu com representantes do banco para discutir novas oportunidades de colaboração. Essa iniciativa pode fortalecer a presença do Bradesco em regiões específicas, contribuindo para o desenvolvimento local e melhorando a percepção da marca entre a comunidade. Além disso, o banco também está investindo em programas de estágio, como o Programa de Estágio 2026, que oferece vagas em diversas regiões e benefícios atraentes para estudantes de graduação, o que pode ajudar a atrair e reter talentos jovens e qualificados.


🔹 No entanto, o Bradesco também enfrenta desafios, como a necessidade de ressarcir vítimas de golpes, como o caso do falso frete, onde o banco, junto com o Sicredi, foi condenado a ressarcir uma vítima em R$ 92 mil. Esses incidentes podem afetar negativamente a reputação do banco, destacando a importância de melhorar a segurança e a proteção aos clientes contra fraudes. É fundamental que o Bradesco invista em medidas de prevenção e educação financeira para minimizar esses riscos e manter a confiança de seus clientes.


🔹 Em termos de desempenho financeiro, o Bradesco é apontado como um dos possíveis grandes vencedores dos balanços, de acordo com análises do mercado. Isso sugere que o banco está em uma posição sólida para enfrentar os desafios do setor financeiro e pode oferecer resultados positivos para seus investidores. Além disso, a capacidade do Bradesco de se conectar com seus clientes através de diversas plataformas, desde o WhatsApp até a Copa do Mundo, demonstra sua estratégia de estar presente em diferentes canais e eventos, buscando manter uma relação próxima e personalizada com sua base de clientes."
Santander,86,34.49,71632364.0,187.0,24301.0,Não informado no período,1ºT/2026,"🔹 O Santander anunciou a abertura de 240 vagas de emprego em todo o Brasil, oferecendo uma variedade de cargos e benefícios atraentes. Essa iniciativa demonstra o compromisso do banco em investir no desenvolvimento de sua força de trabalho e contribuir para a economia local. Além disso, o banco também tem se destacado por suas previsões econômicas, como o relatório que aponta os estados que mais devem crescer no Brasil em 2027, mostrando sua capacidade de análise e entendimento do mercado.

 

🔹 O Santander também tem feito movimentos estratégicos no que diz respeito à sua presença física e operações. Por exemplo, a desocupação de uma agência e o encerramento de atividades presenciais em Cruzeiro, SP, podem indicar uma transição para modelos de atendimento mais digitais e eficientes. Além disso, o banco tem se destacado por suas recomendações de investimento, como a alta potencial de 115% em certas ações, demonstrando sua capacidade de análise de mercado e orientação para os investidores.

 

🔹 Em termos de inovação e expansão de serviços, o Santander lançou o Santander Select, que já representa 20% do banco, e oferece opções de financiamento e parcelamento de compras, como o Santander Shopping, que permite parcelar compras em até 21 vezes. Essas iniciativas demonstram a capacidade do banco de se adaptar às necessidades dos clientes e oferecer soluções inovadoras para o mercado. Além disso, o banco também se destacou por ultrapassar a dona da Zara como a empresa mais valiosa da Espanha, mostrando seu crescimento e solidez financeira."
Nubank,47,10.65,114737784.0,78.0,31143.0,Não informado no período,1ºT/2026,"🔹 O Nubank tem se destacado por sua expansão e crescimento no mercado financeiro, com notícias recentes destacando sua liderança como principal instituição financeira dos brasileiros. De acordo com relatórios, o Nubank já bancarizou 31,5 milhões de pessoas, mostrando seu impacto significativo na inclusão financeira no Brasil. Além disso, o banco tem sido mencionado em pesquisas regionais, como no Acre, onde quase 30% dos acreanos abriram sua primeira conta pelo Nubank, indicando a capacidade do banco de atrair novos clientes e expandir sua base de operações.


🔹 O Nubank também tem sido objeto de notícias sobre possíveis aquisições e parcerias, com especulações sobre a compra de bancos conhecidos internacionalmente e a obtenção de licenças bancárias no Brasil. Relatos apontam que o Nubank está na reta final para adquirir a Caixa, o que poderia significativamente ampliar sua atuação no mercado brasileiro. Além disso, há notícias sobre a formalização de propostas para comprar unidades no Brasil do maior banco de Portugal, avaliadas em R$ 250 milhões, demonstrando a estratégia do Nubank de consolidar sua presença no mercado financeiro.


🔹 Em termos de desempenho no mercado, o Nubank tem se destacado por sua performance nas bolsas, com notícias destacando seu desempenho positivo em comparação com outros bancos digitais. Enquanto XP e Agibank caíram, o Nubank e o PicPay disparam nas bolsas, mostrando a confiança dos investidores na capacidade do Nubank de continuar crescendo e inovando no setor financeiro. Além disso, o Nubank tem se esforçado para transparentar suas práticas, detalhando os motivos que levam ao bloqueio ou encerramento de contas de clientes, o que pode contribuir para uma melhor experiência do cliente e uma reputação mais sólida."
Caixa,75,23.12,158194617.0,165.0,21753.0,Não informado no período,1ºT/2026,"🔹 O banco Caixa alcançou um marco importante em seu crédito habitacional, atingindo R$ 1 trilhão em crédito imobiliário. Isso demonstra a força e a confiança do mercado na instituição financeira, especialmente em programas como o Minha Casa Minha Vida. Além disso, a Caixa Consórcio também assumiu a liderança em contemplações imobiliárias, reforçando a posição da Caixa no setor de habitação.


🔹 A Justiça Federal concedeu um prazo de 10 anos para um produtor pagar suas dívidas com a Caixa, mostrando a flexibilidade e a disposição do banco em encontrar soluções para os clientes que enfrentam dificuldades financeiras. Essa decisão pode ser vista como um exemplo de como a Caixa busca equilibrar seus interesses com a necessidade de apoiar seus clientes em momentos de crise.


🔹 Além disso, a Caixa também está oferecendo a oportunidade para que milhares de pessoas resgatem valores esquecidos do antigo PIS/Pasep, tanto na Caixa quanto no Banco do Brasil. Essa iniciativa demonstra o compromisso da instituição em ajudar os cidadãos a recuperar seus recursos e promover a transparência e a acessibilidade em seus serviços."
C6,4,55.3,34326775.0,371.0,7347.0,Não informado no período,1ºT/2026,"🔹 O C6 Bank tem se destacado por suas estratégias inovadoras e recomendadas para investimentos em 2026, especialmente considerando a queda nos juros. De acordo com uma notícia publicada na BeInCrypto, o banco oferece orientações sobre os melhores investimentos para o ano, demonstrando sua preocupação em ajudar os clientes a tomar decisões financeiras informadas. Isso sugere que o C6 Bank está se posicionando como um parceiro confiável para os investidores, buscando oferecer soluções personalizadas e eficazes para maximizar os retornos em um cenário de juros em declínio.

 

🔹 O C6 Bank também tem feito movimentos significativos no que diz respeito à competitividade no mercado de cartões, como destacado em uma notícia do Estadão. Aumentando a pontuação de cartão, o banco busca ampliar sua participação na disputa pela clientela de alta renda. Essa estratégia não apenas reflete a ambição do C6 Bank em expandir sua base de clientes de alto valor, mas também indica uma abordagem proativa para se manter competitivo em um mercado financeiro cada vez mais dinâmico e exigente.

 

🔹 A figura de Marcelo Kalim, fundador do C6 Bank, também tem sido objeto de interesse, com uma biografia destacando sua carreira no BTG Pactual e o processo de fundação do C6 Bank, conforme publicado no Mitrade. A trajetória de Kalim e sua visão para o C6 Bank podem influenciar a percepção pública do banco, especialmente entre os investidores e clientes que valorizam a experiência e a liderança visionária. Isso pode contribuir para a reputação do C6 Bank como uma instituição financeira inovadora e bem liderada."
BTG Pactual,62,42.81,27389127.0,239.0,7867.0,Não informado no período,1ºT/2026,"🔹 O BTG Pactual tem feito movimentos estratégicos no mercado financeiro, como a troca de ações em sua carteira de small caps para julho, indicando uma busca por oportunidades de crescimento e diversificação. Além disso, o banco tem apostado em setores específicos, como o de defesa, onde a Embraer é uma das empresas destacadas, com previsões de alta significativa nos próximos anos. Essas ações demonstram a capacidade do BTG Pactual de se adaptar e investir em diferentes setores, buscando maximizar os retornos para seus investidores.


🔹 O banco também tem se destacado por suas análises e recomendações de investimento, como no caso da Embraer, onde o BTG Pactual prevê um aumento significativo no valor das ações. Além disso, a instituição financeira tem investido em fintechs, como a colombiana, mostrando seu interesse em inovação e tecnologia. Esses movimentos indicam que o BTG Pactual está comprometido em oferecer soluções inovadoras e oportunidades de investimento atraentes para seus clientes.


🔹 Em relação à reputação, o BTG Pactual enfrentou questões relacionadas à distribuição de CDBs do Banco Master, mas segundo André Esteves, o banco não cometeu irregularidades. Além disso, o crescimento do crédito direcionado, que disparou 8%, sustenta o crescimento do crédito no Brasil, conforme apontado pelo BTG Pactual. Esses indicadores sugerem que, apesar de desafios, o banco mantém uma postura proativa e comprometida com o crescimento sustentável e a confiança dos investidores."
PicPay,17,37.22,68839517.0,514.0,9459.0,Não informado no período,1ºT/2026,"🔹 O PicPay tem enfrentado desafios recentes relacionados à confiança e fiscalização, com notícias sobre investigações e ""class action"" afetando sua reputação. O caso mais notável é a investigação sobre a folha de servidores, que também envolve o BRB, e a menção ao PicPay em artigos sobre falhas na fiscalização do mercado de bancos médios. Esses eventos podem impactar a percepção dos investidores e usuários sobre a estabilidade e confiabilidade do banco.

 

🔹 Por outro lado, o PicPay também tem apresentado movimentos positivos, como o lançamento de novas funcionalidades no aplicativo, incluindo a liberação de ações e fundos imobiliários. Além disso, a empresa tem visto um aumento no número de usuários de agregador de ativos, com uma alta de 60% de acordo com relatórios. Esses desenvolvimentos sugerem que o PicPay está trabalhando para expandir seus serviços e melhorar a experiência do usuário, o que pode ajudar a contrabalançar as notícias negativas.

 

🔹 Em termos de desempenho no mercado, as ações do PicPay têm apresentado resultados mistos. Após uma queda significativa, as ações do banco dispararam em Wall Street após a Citi iniciar cobertura com recomendação de compra. No entanto, a empresa ainda enfrenta desafios, como a investigação e a ""class action"", que podem afetar sua reputação e desempenho a longo prazo. É importante monitorar esses desenvolvimentos para entender melhor a trajetória do PicPay no mercado financeiro."
Inter,14,34.86,43178240.0,167.0,8097.0,Não informado no período,1ºT/2026,"🔹 O Banco Inter enfrentou instabilidade no seu aplicativo, com clientes relatando problemas de acesso e uso do serviço. Isso pode afetar negativamente a reputação do banco, especialmente se não for resolvido rapidamente, pois a disponibilidade e a confiabilidade dos serviços digitais são fundamentais para a satisfação dos clientes. Além disso, o sindicato dos bancários entregou uma pauta de reivindicações específicas ao Banco Inter, o que pode indicar tensões trabalhistas e potenciais impactos na imagem do banco.


🔹 O Banco Inter também realizou uma ""semana do turismo"" para medir o consumo às vésperas do Inter Day, o que pode ser visto como uma estratégia para impulsionar as vendas e o engajamento dos clientes. Além disso, o banco foi incluído na carteira de small caps do BTG para julho, o que pode ser um sinal de confiança dos investidores na instituição. Esses movimentos podem contribuir positivamente para a reputação do banco, demonstrando sua capacidade de inovar e se adaptar às necessidades dos clientes.


🔹 O Banco Inter também teve um desempenho destacado em termos de redução de reclamações, melhorando sua posição no Ranking de Reclamações do BC graças ao seu programa de Customer Experience (CX). Isso é um indicador importante da qualidade dos serviços oferecidos pelo banco e de sua capacidade de atender às necessidades dos clientes. Além disso, o banco tem visto oportunidades de investimento atraentes na renda fixa, especialmente nos títulos IPCA+8%, o que pode ser visto como uma estratégia para diversificar suas ofertas e atrair mais clientes."
