bank,qtd_noticias_recentes,indice_bcb,total_clientes,recl_procedentes,total_respondidas,principal_motivo,periodo,resumo_insight_ia
Itaú,38,34.12,100863694.0,361.0,27703.0,Não informado no período,1ºT/2026,"Aqui estão 3 tópicos curtos sobre as notícias do banco Itaú, focando no sentimento do cliente e temas principais:

1. **Cobranças indevidas**: O Itaú admitiu ter cobrado indevidamente seguros de seus clientes por 14 anos, o que gerou um sentimento de insatisfação e desconfiança entre os clientes. O banco prometeu ressarcir os clientes afetados.
2. **Ressarcimento e compensação**: O Itaú anunciou que pagará R$ 3,99 bilhões a acionistas após admitir as cobranças indevidas. No entanto, alguns clientes podem ter dificuldades em obter o ressarcimento devido às barreiras impostas pelo banco.
3. **Impacto na reputação**: A notícia das cobranças indevidas pode afetar negativamente a reputação do Itaú e a confiança dos clientes. No entanto, o banco continua a realizar operações normais e a anunciar novas iniciativas, como a inclusão no índice de mercados emergentes da MSCI."
Bradesco,34,48.92,110328071.0,348.0,35387.0,Não informado no período,1ºT/2026,"Aqui estão 3 tópicos curtos sobre as notícias do banco Bradesco, focando no sentimento do cliente e temas principais:

1. **Lucro e Expansão**: O Bradesco apresentou um lucro crescente de 16% e aprovou um JCP de R$ 3 bilhões, o que pode ser visto como um sinal positivo para os clientes. Além disso, o banco está expandindo suas operações, com a abertura de 213 vagas de emprego no Brasil, especialmente em áreas de tecnologia, negócios e atendimento.
2. **Problemas Técnicos e Reclamações**: No entanto, os clientes do Bradesco também enfrentaram problemas técnicos, como a instabilidade do Pix, o que gerou reclamações e frustração. Além disso, o banco foi condenado a indenizar um cliente em mais de R$ 53 mil, o que pode afetar a confiança dos clientes.
3. **Foco no Cliente de Alta Renda**: O Bradesco também está se concentrando em atrair clientes de alta renda, com a abertura de vagas para atuação nesse segmento. Isso pode ser visto como um sinal de que o banco está procurando atender às necessidades específicas desses clientes, mas também pode gerar preocupações sobre a acessibilidade e a inclusão para clientes de menor renda."
Santander,37,34.49,71632364.0,187.0,24301.0,Não informado no período,1ºT/2026,"**Resumo das Notícias do Banco Santander**

Aqui estão 3 tópicos curtos sobre as notícias do banco Santander, focando no sentimento do cliente e temas principais:

1. **Cartões de Crédito**: O Santander removeu os cartões American Express da página de solicitação e suspendeu a comercialização desses cartões. No entanto, o banco também anunciou a ampliação da pontuação do programa Santander Rewards, o que pode ser visto como uma medida para manter os clientes satisfeitos.
2. **Inovação e Expansão**: O Santander está investindo em inovação, com a incorporação da Esfera Fidelidade, uma subsidiária de programas de fidelidade. Além disso, o banco está expandindo seus serviços, como a gestão da folha de pagamento de servidores e a abertura de contas para aposentados, pensionistas e servidores.
3. **Relacionamento com Clientes**: O Santander está enfrentando desafios no relacionamento com os clientes, com notícias sobre a necessidade de indenizar um cliente negativado após renegociação de dívida. No entanto, alguns clientes estão satisfeitos com os serviços do banco, como o cartão Santander Unlimited, que é considerado um dos melhores cartões de crédito."
Nubank,37,10.65,114737784.0,78.0,31143.0,Não informado no período,1ºT/2026,"Aqui estão 3 tópicos curtos sobre as notícias do Nubank, focando no sentimento do cliente e temas principais:

1. **Problemas com juros e dívidas**: Vários clientes estão relatando problemas com juros altos e dívidas que estão crescendo rapidamente, com casos de dívidas aumentando até 65 vezes. Isso está gerando insatisfação e preocupação entre os clientes.
2. **Instabilidades e falhas no serviço**: O Nubank está enfrentando problemas de instabilidade, incluindo a queda do serviço PIX, o que está afetando a experiência do cliente e gerando frustração.
3. **Desconfiança e incerteza**: Com notícias sobre possíveis mudanças e decisões do Banco Central, alguns clientes estão se perguntando se o Nubank vai fechar ou se haverá mudanças significativas no serviço. Isso está gerando desconfiança e incerteza entre os clientes."
Caixa,38,23.12,158194617.0,165.0,21753.0,Não informado no período,1ºT/2026,"Aqui estão 3 tópicos curtos sobre as notícias do banco Caixa, focando no sentimento do cliente e temas principais:

1. **Oportunidades de emprego**: O banco Caixa está estudando a realização de um novo concurso para Técnico Bancário, o que pode gerar milhares de oportunidades de emprego para nível médio, com salários de até R$ 5 mil.
2. **Preocupações dos funcionários**: No entanto, os funcionários do banco Caixa estão relatando um cenário de sobrecarga e adoecimento devido à falta de resposta do banco sobre questões como a Saúde Caixa e a Super Caixa.
3. **Expansão e parcerias**: O banco Caixa também está buscando expandir suas operações, com a busca por capitalização bilionária com apoio de outros bancos, como o BB, Itaú, Bradesco, Santander e BTG, o que pode indicar um crescimento e fortalecimento do banco no mercado."
C6,39,55.3,34326775.0,371.0,7347.0,Não informado no período,1ºT/2026,"**Resumo das Notícias do C6 Bank**

Aqui estão 3 tópicos curtos sobre as notícias do C6 Bank, focando no sentimento do cliente e temas principais:

1. **Inovação e Tecnologia**: O C6 Bank está expandindo o uso de Inteligência Artificial (IA) para engajar clientes e melhorar a experiência do usuário. Isso inclui a lançamento de uma ferramenta de IA que permite que os clientes ""conversem"" com a fatura do cartão.
2. **Desempenho Financeiro**: O C6 Bank apresentou um crescimento na carteira de crédito e lucrou R$ 2,46 bilhões. No entanto, também enfrentou problemas, como a suspensão da oferta de novos consignados pelo INSS e a multa de R$ 160 mil por empréstimo consignado fraudulento.
3. **Problemas e Controvérsias**: O C6 Bank está enfrentando problemas de reputação, incluindo a investigação de possíveis fraudes e a interrupção dos planos de emitir bonds. Além disso, o banco foi multado por empréstimo consignado fraudulento e teve a oferta de novos consignados suspensa pelo INSS. Isso pode afetar negativamente o sentimento dos clientes em relação ao banco."
BTG Pactual,39,42.81,27389127.0,239.0,7867.0,Não informado no período,1ºT/2026,"**Resumo das Notícias do Banco BTG Pactual em 3 Tópicos**

1. **Expansão e Incorporação**: O BTG Pactual aumentou sua participação no Banco Pan, passando a deter mais da metade das ações. Isso pode indicar uma maior integração entre as duas instituições e potencialmente afetar a experiência do cliente.
2. **Crescimento e Rentabilidade**: O BTG Pactual alcançou um recorde de lucro e receita, com um Roae de 26,6%. Além disso, o CEO do banco espera que a rentabilidade do Banco Pan alcance a do grupo até 2028, o que pode refletir em melhorias nos serviços oferecidos aos clientes.
3. **Foco no Varejo e Inovação**: O BTG Pactual está apostando em operações de varejo como uma avenida de crescimento, e também participará do Desenrola 2.0, um programa de inovação. Isso pode indicar que o banco está se esforçando para melhorar a experiência do cliente e oferecer serviços mais inovadores e personalizados."
PicPay,39,37.22,68839517.0,514.0,9459.0,Não informado no período,1ºT/2026,"Aqui estão 3 tópicos curtos sobre as notícias do banco PicPay, focando no sentimento do cliente e temas principais:

1. **Expansão e Crescimento**: O PicPay está expandindo sua presença no mercado, com a aquisição de seguradoras e parcerias com empresas como a TIM. Isso pode ser visto como um sinal de crescimento e confiança na marca, o que pode ser positivo para os clientes.
2. **Desafios e Controvérsias**: No entanto, o PicPay também está enfrentando desafios, como a investigação da Cade sobre a venda de seguradoras e a devolução de cerca de 1 milhão de reais cobrados a título de seguro prestamista. Isso pode gerar preocupação e desconfiança entre os clientes.
3. **Perspectivas e Reconhecimento**: Apesar dos desafios, o PicPay está recebendo reconhecimento e atenção dos analistas, com uma liderança nos ganhos em dia positivo para fintechs nos EUA e um upgrade na Moody's. Além disso, a empresa está se preparando para realizar um IPO, o que pode ser visto como um sinal de confiança e estabilidade."
Inter,37,34.86,43178240.0,167.0,8097.0,Não informado no período,1ºT/2026,"Aqui estão 3 tópicos curtos sobre as notícias do Banco Inter, focando no sentimento do cliente e temas principais:

1. **Desempenho financeiro**: O Banco Inter apresentou resultados positivos no 4º trimestre de 2025, com um ROE acima de 15% e lucro anual recorde. Isso pode gerar confiança nos clientes e investidores.
2. **Críticas à remuneração de executivos**: A remuneração milionária de executivos do Banco Inter está gerando pressão e críticas de investidores e funcionários. Isso pode afetar a percepção dos clientes sobre a gestão do banco e sua responsabilidade social.
3. **Inovação e concorrência**: O Banco Inter está investindo em novas ofertas, como o ""Meu Porquinho por Objetivos"", para atrair clientes de cofrinhos digitais. Além disso, o banco está apostando em linhas de crédito com garantias em um cenário de juro alto. Isso pode ser visto como uma estratégia para manter a competitividade e atrair novos clientes."
