bank,qtd_noticias_recentes,indice_bcb,total_clientes,recl_procedentes,total_respondidas,principal_motivo,periodo,resumo_insight_ia
Itaú,39,34.12,100863694.0,361.0,27703.0,Não informado no período,1ºT/2026,"Aqui estão 3 tópicos curtos sobre as notícias do banco Itaú, focando no sentimento do cliente e temas principais:

1. **Cobranças indevidas**: O Itaú está enfrentando problemas com cobranças indevidas de clientes, com prazos para ressarcimento até 2028. Isso pode gerar insatisfação e desconfiança entre os clientes.
2. **Desempenho financeiro**: O banco apresentou um ganho de 45,7% e um lucro de 10%, o que pode ser visto como positivo para os investidores. No entanto, isso também pode ser contrastado com a sobrecarga e demissões de bancários.
3. **Inovação e patrocínio**: O Itaú está investindo em inovação, como o lançamento do cartão World Legend, e em patrocínio, como a Copa do Mundo. Isso pode ser visto como uma estratégia para melhorar a experiência do cliente e aumentar a visibilidade da marca."
Bradesco,37,48.92,110328071.0,348.0,35387.0,Não informado no período,1ºT/2026,"Aqui estão 3 tópicos curtos sobre as notícias do banco Bradesco, focando no sentimento do cliente e temas principais:

1. **Reconhecimento e Inovação**: O Bradesco foi eleito o melhor banco em tecnologia do mundo, conquistando quatro prêmios do The Banker Technology Awards 2026. Isso demonstra o compromisso do banco em investir em tecnologia e inovação para melhorar a experiência do cliente.
2. **Críticas e Desafios**: No entanto, o banco também enfrentou críticas por práticas abusivas contra consumidores do Ceará, sendo autuado pela Decon. Além disso, os clientes precisam estar preparados para mudanças no dia 04/06, o que pode gerar incerteza e ansiedade.
3. **Expansão e Transformação**: O Bradesco está acelerando sua transformação para se tornar ""um banco mais leve"" e está estudando a entrada no comércio de energia. Além disso, o banco está expandindo sua presença em eventos e festas, como as festas de São João em Campina Grande e Caruaru. Isso demonstra a busca do banco por diversificar seus serviços e melhorar a experiência do cliente."
Santander,39,34.49,71632364.0,187.0,24301.0,Não informado no período,1ºT/2026,"Aqui estão 3 tópicos curtos sobre as notícias do banco Santander, focando no sentimento do cliente e temas principais:

1. **Demissões e Cortes**: O Santander está demitindo gerentes de atendimento e outros funcionários, o que pode afetar a experiência do cliente. Isso gerou críticas de sindicatos e bancários, que acusam o banco de cortar cargos sem negociação.
2. **Mudanças nos Serviços**: O banco está aumentando as exigências para usar salas VIP com cartões Unique e Unlimited, o que pode desagradar os clientes que utilizam esses serviços. Além disso, o Santander está fechando agências e transformando-as em outros espaços, como academias de ginástica.
3. **Oportunidades e Investimentos**: Por outro lado, o Santander está oferecendo oportunidades de emprego, como o programa de trainee para recém-formados, e investindo em emissão de títulos para fortalecer sua posição financeira. Isso pode ser visto como um sinal de crescimento e estabilidade para os clientes e investidores."
Nubank,39,10.65,114737784.0,78.0,31143.0,Não informado no período,1ºT/2026,"Aqui estão 3 tópicos curtos sobre as notícias do Nubank, focando no sentimento do cliente e temas principais:

1. **Crescimento e Relevância**: O Nubank alcançou a marca de ter metade do Brasil como clientes, mas agora enfrenta o desafio de se manter relevante. Isso pode afetar a confiança dos clientes e a percepção da marca.
2. **Flutuação no Mercado**: As ações do Nubank têm apresentado flutuações significativas, com quedas de até 11% em três dias e 10% em dois dias. Isso pode gerar incerteza e preocupação entre os clientes e investidores.
3. **Inovação e Serviços**: O Nubank continua a lançar novas ferramentas e serviços, como a monitoramento do CPF e a renegociação de dívidas pelo app. Isso pode ser visto como um ponto positivo para os clientes, que valorizam a inovação e a conveniência."
Caixa,40,23.12,158194617.0,165.0,21753.0,Não informado no período,1ºT/2026,"Aqui estão 3 tópicos curtos sobre as notícias do banco Caixa, focando no sentimento do cliente e temas principais:

1. **Segurança e Golpes**: O banco Caixa está enfrentando problemas de segurança, com golpes por WhatsApp e ataques de hackers que já somam R$ 1,2 bi em prejuízos. Isso pode gerar preocupação e desconfiança entre os clientes.
2. **Concurso e Oportunidades**: A Caixa está com um concurso em andamento para Técnico Bancário, e a banca organizadora pode já estar definida. Isso pode gerar expectativa e interesse entre os candidatos.
3. **Desempenho Financeiro e Serviços**: A Caixa apresentou um lucro líquido de R$ 1,8 bi no 2º trimestre, e está disponibilizando canais para renegociação do Fies. No entanto, também está mantendo critérios contestados no Super Caixa, o que pode gerar insatisfação entre os clientes."
C6,39,55.3,34326775.0,371.0,7347.0,Não informado no período,1ºT/2026,"Aqui estão 3 tópicos curtos sobre as notícias do banco C6, focando no sentimento do cliente e temas principais:

1. **Reclamações e Críticas**: O C6 Bank lidera o ranking de reclamações do Banco Central no 1º trimestre de 2026, o que pode indicar insatisfação dos clientes com os serviços oferecidos.
2. **Inovações e Serviços**: O banco lançou o C6 Tap to Pay, que permite transformar o celular em uma maquininha de cartão, e também oferece dicas de investimentos para 2026, mostrando esforços para melhorar a experiência do cliente.
3. **Controvérsias e Vitórias**: O C6 Bank obteve autorização judicial para retomar o crédito consignado após uma suspensão pelo INSS, o que pode ser visto como uma vitória para o banco, mas também pode gerar preocupações entre os clientes sobre a estabilidade e confiabilidade dos serviços."
BTG Pactual,40,42.81,27389127.0,239.0,7867.0,Não informado no período,1ºT/2026,"Aqui estão 3 tópicos curtos sobre as notícias do banco BTG Pactual, focando no sentimento do cliente e temas principais:

1. **Crescimento e Expansão**: O BTG Pactual está apresentando resultados financeiros recordes, com lucro e receita em alta. A incorporação do Banco Pan e a expansão das operações de varejo são apontadas como principais fatores de crescimento.
2. **Desafios de Integração**: A fusão com o Banco Pan e a unificação das negociações na B3 podem trazer desafios para os clientes, incluindo possíveis mudanças nos serviços e produtos oferecidos. No entanto, o CEO do BTG Pactual expressou confiança em alcançar rentabilidade semelhante à do grupo até 2028.
3. **Preocupações com o Atendimento**: Embora o BTG Pactual esteja apresentando resultados financeiros positivos, o banco lidera as queixas contra bancos no 1º trimestre, junto com o Bradesco e a C6. Isso pode indicar que os clientes estão enfrentando desafios com o atendimento e os serviços oferecidos pelo banco."
PicPay,39,37.22,68839517.0,514.0,9459.0,Não informado no período,1ºT/2026,"Aqui estão 3 tópicos curtos sobre as notícias do banco PicPay, focando no sentimento do cliente e temas principais:

1. **Desempenho financeiro**: O PicPay apresentou crescimento robusto no 1T26, superando as expectativas, mas o sentimento do mercado não foi positivo, com a ação caindo 19% e perdendo 52% desde o IPO.
2. **Problemas de reputação**: O PicPay lidera o ranking de reclamações do Banco Central no quarto trimestre de 2025, o que pode afetar a confiança dos clientes. Além disso, o Cade está investigando a venda de seguradora do Banco Master para o PicPay.
3. **Estratégias de crescimento**: O PicPay está apostando no consignado privado e ampliando suas possibilidades com o PicPay Ads, que acompanha a jornada completa do consumidor. O banco também fechou um patrocínio com o Esporte Clube Pinheiros, o que pode ajudar a melhorar sua imagem junto aos clientes."
Inter,40,34.86,43178240.0,167.0,8097.0,Não informado no período,1ºT/2026,"Aqui estão 3 tópicos curtos sobre as notícias do banco Inter, focando no sentimento do cliente e temas principais:

1. **Expansão Internacional**: O banco Inter recebeu licença para operar uma filial nos EUA, o que pode ser visto como uma oportunidade para os clientes brasileiros que têm negócios ou interesses nos Estados Unidos. Isso pode melhorar a experiência do cliente e expandir os serviços oferecidos.
2. **Inovação e Tecnologia**: O Inter lançou relógios, anéis e pulseiras inteligentes para facilitar as transações bancárias, o que pode ser visto como uma iniciativa inovadora e conveniente para os clientes. Isso pode melhorar a experiência do cliente e tornar as transações mais fáceis e seguras.
3. **Crescimento e Diversificação**: O Inter alcançou 1 milhão de clientes de alta renda e está explorando oportunidades bilionárias no exterior, o que pode ser visto como um sinal de crescimento e diversificação da instituição. Isso pode gerar confiança nos clientes e atrair novos investidores."
