bank,qtd_noticias_recentes,indice_bcb,total_clientes,recl_procedentes,total_respondidas,principal_motivo,periodo,resumo_insight_ia
Itaú,218,34.12,100863694.0,361.0,27703.0,Não informado no período,1ºT/2026,"🔹 O Itaú tem enfrentado desafios relacionados à sua reputação devido a reportagens e críticas em redes sociais. O banco afirmou que, em 10 semanas, houve 42 matérias e cerca de 50 posts em redes sociais com ""informações deturpadas"" sobre a instituição, o que levou à criação de um site para rebater essas acusações. Esse movimento demonstra a preocupação do Itaú em manter sua imagem positiva perante o público e os clientes.


🔹 Em outro frente, o Itaú tem buscado expandir seus serviços e parcerias. O banco pagou R$ 2,1 bilhões para adquirir a folha de pagamento de 670 mil servidores do estado de Minas Gerais, o que pode ser visto como uma estratégia para aumentar sua base de clientes e oferecer serviços mais personalizados. Além disso, a parceria com a Samsung para oferecer cartões de crédito conjuntos foi encerrada, o que pode ser um sinal de reestruturação de suas ofertas de produtos.


🔹 O Itaú também tem se destacado por suas análises e previsões econômicas. A Itaú BBA prevê que o El Niño forte em Mato Grosso pode afetar a produção de soja, tirando 5 milhões de toneladas da balança global. Além disso, o banco tem mantido sua confiança no crédito do setor sucroenergético, apesar de considerar a Raízen como um caso isolado. Essas análises demonstram a capacidade do Itaú de entender e interpretar tendências econômicas, o que pode ser um fator positivo para sua reputação."
Bradesco,86,48.92,110328071.0,348.0,35387.0,Não informado no período,1ºT/2026,"🔹 O Bradesco lançou seu Programa de Estágio 2026, com inscrições abertas até 31 de julho, oferecendo vagas em diversas regiões e benefícios atraentes para estudantes de graduação. Esse movimento demonstra o compromisso do banco em investir no desenvolvimento de jovens talentos e atrair futuros profissionais para sua equipe. Além disso, a abertura dessas vagas pode contribuir positivamente para a reputação do Bradesco, mostrando sua preocupação com a formação de recursos humanos e o desenvolvimento de carreiras.


🔹 O Bradesco também tem sido destacado por sua estratégia de marketing e engajamento com os clientes, como exemplificado pela sua presença em eventos como a Copa do Mundo e sua utilização de plataformas como o WhatsApp para se conectar com os clientes. Além disso, o banco decidiu investir no automobilismo, o que pode ser visto como uma estratégia para alcançar um público mais amplo e diversificado. Essas ações demonstram a capacidade do Bradesco de se adaptar e inovar em sua abordagem de marketing e relações com os clientes.


🔹 No entanto, o Bradesco também enfrenta desafios, como o aumento de até 185% nos preços de alguns de seus serviços, o que pode afetar negativamente a percepção dos clientes sobre o banco. Além disso, o banco está sob escrutínio devido a suas práticas de empréstimo e gestão de dívidas, como no caso de um ex-jogador da Seleção que recebeu um desconto e parcelou sua dívida até 2031. Esses eventos podem ter um impacto negativo na reputação do Bradesco, especialmente se não forem gerenciados de forma transparente e justa."
Santander,90,34.49,71632364.0,187.0,24301.0,Não informado no período,1ºT/2026,"🔹 O Santander defendeu a transferência da Coleção Gelman para a Espanha, negando violação da lei mexicana. Esse movimento está relacionado a uma coleção de arte que foi objeto de disputa legal entre o México e a Espanha. A posição do Santander nesse caso pode ter implicações na percepção pública da instituição, especialmente em relação à sua atuação em questões culturais e legais internacionais.

 

🔹 O banco Santander também se destacou por sua participação em iniciativas de educação e desenvolvimento profissional, como a oferta de bolsas para um curso de automação em parceria com a DIO. Além disso, o Santander foi mencionado em estudos econômicos, como um que aponta a Paraíba para liderar o crescimento econômico do Nordeste em 2026. Esses movimentos demonstram o compromisso do banco com o desenvolvimento regional e a formação de habilidades para o mercado de trabalho.

 

🔹 No entanto, o Santander também enfrentou desafios, como a detecção de uma fraude informática que visava o banco, com a Polícia Judiciária (PJ) desmantelando a operação e detendo suspeitos. Além disso, o banco foi mencionado em contextos de recuperação financeira de empresas, como a Ambipar, e em análises de mercado sobre dividendos e small caps. Esses eventos mostram a complexidade da atuação do Santander no mercado financeiro e a necessidade de gerenciar riscos e oportunidades de forma eficaz."
Nubank,51,10.65,114737784.0,78.0,31143.0,Não informado no período,1ºT/2026,"🔹 O Nubank está se movendo agressivamente no mercado financeiro brasileiro, com notícias recentes indicando que a instituição está na reta final para comprar a Caixa e obter uma licença bancária no Brasil. Isso representa um grande passo para o Nubank, que busca expandir sua presença no mercado e oferecer mais serviços aos seus clientes. Além disso, a compra de uma unidade do maior banco de Portugal no Brasil, avaliada em R$ 250 milhões, também está em andamento, o que demonstra a estratégia de crescimento do Nubank por meio de aquisições estratégicas.


🔹 O Nubank também tem sido destaque por sua capacidade de bancarizar a população brasileira, especialmente em regiões mais remotas. De acordo com pesquisas, quase 30% dos acreanos abriram sua primeira conta pelo Nubank, e em Roraima e Amapá, mais de 70% dos clientes são do Nubank. Isso demonstra a eficácia da estratégia do Nubank em atingir mercados que tradicionalmente têm sido desatendidos pelos bancos tradicionais. Além disso, o Nubank já bancarizou 31,5 milhões de pessoas, o que o coloca como a principal instituição financeira dos brasileiros.


🔹 A presença do Nubank em diferentes regiões do Brasil também é notável, com o banco sendo responsável por quase 3 em cada 10 primeiros contatos com o sistema financeiro no Acre. Isso sugere que o Nubank está desempenhando um papel importante na inclusão financeira de populações que anteriormente não tinham acesso a serviços bancários. Com sua abordagem inovadora e foco em atender às necessidades dos clientes, o Nubank continua a liderar o mercado financeiro brasileiro e a expandir sua base de clientes."
Caixa,81,23.12,158194617.0,165.0,21753.0,Não informado no período,1ºT/2026,"🔹 O banco Caixa Econômica alcançou uma marca significativa ao atingir R$ 1 trilhão em crédito imobiliário, conforme reportado por várias fontes, incluindo Acionista.com.br, Grupo Repórter, portas.com.br, InfoMoney, Alagoas Alerta, G1, Economic News Brasil e Campo Grande News. Esse crescimento é atribuído, em parte, ao programa Minha Casa, Minha Vida (MCMV), que tem impulsionado o mercado da casa própria no Brasil. O aumento de 14,2% no crédito habitacional da Caixa em um ano é um indicador positivo para o setor imobiliário e para a instituição financeira.

 

🔹 Em contraste com as notícias positivas sobre o crescimento do crédito imobiliário, uma notícia publicada pelo Diário do Comércio gerou preocupação entre os clientes da Caixa, afirmando que o banco estaria confiscando todas as contas bancárias de seus clientes ativos em 2026, com confirmação do governo. No entanto, é importante notar que essa informação não foi amplamente confirmada por outras fontes confiáveis, e pode ser considerada uma notícia falsa ou mal interpretada. A falta de confirmação oficial sobre esse assunto pode afetar a reputação da Caixa, caso não seja esclarecida de forma adequada.

 

🔹 Além do crescimento no crédito imobiliário, a Caixa também tem demonstrado ambições em outras áreas, como a captação de recursos para saneamento. De acordo com uma declaração de Júlio Wiziack, a Caixa tem o objetivo de se tornar líder global nesse setor, conforme reportado pelo UOL Economia. Essa iniciativa pode contribuir para a reputação da Caixa como uma instituição financeira comprometida com o desenvolvimento sustentável e a infraestrutura básica no Brasil, potencialmente abrindo novas oportunidades de negócios e parcerias."
C6,4,55.3,34326775.0,371.0,7347.0,Não informado no período,1ºT/2026,"🔹 O C6 Bank tem se destacado por sua capacidade de inovação e adaptação ao mercado financeiro, como evidenciado pela biografia e carreira de seu fundador, Marcelo Kalim, que teve uma carreira notável no BTG Pactual antes de fundar o C6 Bank. Isso sugere que o banco está liderado por profissionais experientes e visionários, o que pode contribuir positivamente para sua reputação no setor financeiro.


🔹 O C6 Bank também tem oferecido recomendações de investimento para 2026, considerando a queda dos juros, conforme reportado pela BeInCrypto. Essa iniciativa demonstra que o banco está atento às necessidades de seus clientes e está disposto a fornecer orientação especializada para ajudá-los a navegar em um mercado financeiro em constante mudança, o que pode fortalecer a confiança dos clientes na instituição.


🔹 Além disso, o C6 Bank tem ampliado sua disputa pela alta renda, aumentando a pontuação de cartão, como noticiado pelo Estadão. Essa estratégia pode ser vista como um esforço para atrair e reter clientes de alta renda, oferecendo-lhes benefícios e recompensas mais atraentes, o que pode contribuir para o crescimento e a reputação do banco no mercado."
BTG Pactual,58,42.81,27389127.0,239.0,7867.0,Não informado no período,1ºT/2026,"🔹 O BTG Pactual tem se destacado por suas estratégias de investimento e movimentos no mercado financeiro. Uma das notícias recentes destaca a montagem de uma posição em um dos endereços mais valorizados de São Paulo, indicando um interesse do banco em investir em ativos de alto valor. Além disso, o banco tem apontado para um crescimento significativo das ações da Embraer, com previsões de alta de mais de 56% e uma possível dobrada do lucro em 2026. Esses movimentos demonstram a confiança do BTG Pactual no potencial de crescimento de empresas específicas e setores estratégicos.


🔹 O BTG Pactual também tem se envolvido em parcerias e investimentos em fintechs, como a colombiana Addi, na qual liderou um aporte de US$ 85 milhões. Essa estratégia de investimento em empresas de tecnologia financeira reflete a visão do banco sobre o futuro do setor financeiro e a importância de estar à frente das inovações tecnológicas. Além disso, a inclusão de novas ações em sua carteira, como a Ambev e a Allos, mostra a diversificação dos investimentos do banco e sua capacidade de adaptar-se às mudanças do mercado.


🔹 Em um contexto mais amplo, o BTG Pactual tem sido mencionado em notícias relacionadas a questões legais e operacionais, como a atuação de um advogado que recebeu uma grande quantia do Master e agora atua em favor do banco. Além disso, a menção ao banco em relação à possível aquisição da Digimais, junto com outros cinco bancos, destaca a competitividade do setor financeiro e a busca constante por oportunidades de crescimento e expansão. Esses pontos demonstram a complexidade do ambiente em que o BTG Pactual opera e a necessidade de gerenciar diferentes aspectos de sua reputação e presença no mercado."
PicPay,81,37.22,68839517.0,514.0,9459.0,Não informado no período,1ºT/2026,"🔹 O PicPay enfrentou uma crise de confiança recentemente, com uma queda de 50% em seu valor, além de estar sob investigação e ""class action"". No entanto, a empresa conseguiu se recuperar na bolsa, mesmo com esses desafios. Isso pode ser atribuído à recomendação de compra das ações do PicPay por parte do Citi, o que impulsionou seu valor em Wall Street. Além disso, o PicPay também expandiu seus serviços, liberando ações e fundos imobiliários no aplicativo, o que pode ser uma estratégia para atrair mais investidores e melhorar sua reputação.


🔹 Outro ponto importante é a menção do PicPay em investigações sobre falhas na fiscalização, juntamente com outros bancos como o Master e a Digimais. Isso levanta questões sobre a regulação do sistema financeiro e a necessidade de maior controle sobre essas instituições. O MPDFT também está investigando o PicPay, junto com a BRB, sobre uma possível irregularidade na folha de servidores. Essas investigações podem afetar a reputação do PicPay e do setor financeiro como um todo.


🔹 Apesar dos desafios, o PicPay também apresentou alguns resultados positivos, como o aumento de 60% em usuários de agregador de ativos. Isso sugere que a empresa ainda tem potencial de crescimento e pode ser capaz de superar as dificuldades atuais. No entanto, é fundamental que o PicPay e o setor financeiro como um todo tomem medidas para melhorar a transparência e a confiança, a fim de evitar crises futuras e manter a estabilidade do mercado."
Inter,16,34.86,43178240.0,167.0,8097.0,Não informado no período,1ºT/2026,"🔹 O Banco Inter enfrentou recentemente instabilidade em seu aplicativo, com clientes relatando dificuldades de acesso e uso do serviço. Esse problema operacional pode afetar negativamente a reputação do banco, especialmente se não for resolvido de forma eficiente e transparente. A instabilidade no app pode ser um indicador de falhas na infraestrutura tecnológica ou na gestão de capacidade, o que pode preocupar os clientes e potenciais investidores.


🔹 O Banco Inter também tem se envolvido em discussões sobre reivindicações trabalhistas, com o sindicato dos bancários entregando uma pauta de reivindicações específicas ao banco. Essas discussões podem ter implicações na reputação do banco, especialmente se forem percebidas como conflitos trabalhistas ou desrespeito aos direitos dos funcionários. A forma como o banco lida com essas reivindicações pode influenciar a percepção pública sobre sua responsabilidade social e gestão de recursos humanos.


🔹 Por outro lado, o Banco Inter tem apresentado resultados positivos em termos de customer experience, com um programa de CX que melhorou sua posição no Ranking de Reclamações do Banco Central. Além disso, o banco tem se destacado em negociações de BDRs (Bônus de Desempenho de Resultados) na B3, superando empresas como Nvidia e Tesla. Esses resultados podem contribuir para uma reputação mais positiva do banco, especialmente entre investidores e clientes que valorizam a eficiência e o desempenho financeiro."
