bank,qtd_noticias_recentes,indice_bcb,total_clientes,recl_procedentes,total_respondidas,principal_motivo,periodo,resumo_insight_ia
Itaú,36,34.12,100863694.0,361.0,27703.0,Não informado no período,1ºT/2026,"Aqui estão 3 tópicos curtos sobre as notícias do banco Itaú, focando no sentimento do cliente e temas principais:

1. **Proteção para PMEs**: O Itaú lançou um novo seguro para pequenas e médias empresas (PMEs) para reduzir riscos operacionais e protegê-las de transações feitas sob coação, demonstrando preocupação com a segurança e estabilidade desses clientes.
2. **Avaliação do setor financeiro**: O Itaú BBA reduziu a projeção de lucro do Banco do Brasil para 2026 devido à incerteza sobre a inadimplência no setor agro, o que pode afetar a confiança dos clientes no setor financeiro como um todo.
3. **Educação e apoio**: O Itaú BBA também lançou um curso gratuito sobre gestão de riscos no agronegócio, demonstrando um compromisso com a educação e o apoio aos clientes, especialmente aqueles que atuam no setor agro, e buscando ajudá-los a gerenciar melhor os riscos e desafios do setor."
Bradesco,36,48.92,110328071.0,348.0,35387.0,Não informado no período,1ºT/2026,"Aqui estão 3 tópicos curtos sobre as notícias do banco Bradesco, focando no sentimento do cliente e temas principais:

1. **Reconhecimento e Inovação**: O Bradesco foi eleito o melhor banco em tecnologia do mundo e conquistou quatro prêmios do The Banker Technology Awards 2026, demonstrando seu compromisso com a inovação e a modernização. Além disso, a criação do Bradesco Principal, uma startup dentro do banco, mostra a disposição em se adaptar às necessidades dos clientes.

2. **Conexão com a Comunidade**: O Bradesco está se conectando com a cultura nordestina nos festejos de São João, levando ativações às festas em Campina Grande e Caruaru. Isso demonstra a preocupação do banco em se aproximar dos clientes e entender suas necessidades e preferências.

3. **Desafios e Críticas**: No entanto, o Bradesco também enfrenta desafios, como a autuação por práticas abusivas contra consumidores do Ceará e a necessidade de manter a confiança dos clientes. Além disso, a reintegração de uma bancária demitida e a abertura de vagas de emprego em todo o Brasil mostram a importância de manter uma boa relação com os funcionários e os clientes."
Santander,38,34.49,71632364.0,187.0,24301.0,Não informado no período,1ºT/2026,"Aqui estão 3 tópicos curtos sobre as notícias do banco Santander, focando no sentimento do cliente e temas principais:

1. **Demissões e fechamentos de agências**: O Sindicato dos Bancários está protestando contra as demissões e fechamentos de agências do Santander, o que pode afetar negativamente a experiência do cliente.
2. **Problemas de atendimento e pagamento**: Clientes estão relatando problemas de atendimento, como filas longas e atrasos no pagamento de aposentados e pensionistas, o que pode gerar insatisfação e frustração.
3. **Mudanças nos serviços e benefícios**: O Santander está implementando mudanças nos serviços e benefícios, como o aumento das exigências para usar salas VIP com cartões Unique e Unlimited, o que pode ser visto como uma redução nos benefícios oferecidos aos clientes."
Nubank,37,10.65,114737784.0,78.0,31143.0,Não informado no período,1ºT/2026,"Aqui estão 3 tópicos curtos sobre as notícias do Nubank, focando no sentimento do cliente e temas principais:

1. **Benefícios para os clientes**: O Nubank está oferecendo ajuda para quitar dívidas e lançou o cartão Ultravioleta com anuidade grátis no primeiro ano, demonstrando um esforço para melhorar a experiência do cliente.
2. **Crescimento e liderança**: O Nubank lidera o mercado de fintechs brasileiras em termos de lucro, com um total de R$ 7,75 bi no 1T26, e seu CEO foi incluído na lista da Forbes ao lado de personalidades influentes, o que pode gerar confiança e orgulho nos clientes.
3. **Inovação e investimento**: O Nubank está investindo em sua equipe, com a contratação de um novo CISO (Diretor de Segurança da Informação) e anunciou um programa de recompra de ações de US$ 1 bilhão, o que pode ser visto como um sinal de estabilidade e compromisso com o futuro da empresa, o que é benéfico para os clientes."
Caixa,40,23.12,158194617.0,165.0,21753.0,Não informado no período,1ºT/2026,"Aqui estão 3 tópicos curtos sobre as notícias do banco Caixa, focando no sentimento do cliente e temas principais:

1. **Concurso Caixa**: O concurso para técnico bancário da Caixa está em andamento, com salários que podem chegar a R$ 7,7 mil para nível médio. A banca organizadora pode ser a Cesgranrio, o que gerou expectativa entre os candidatos.
2. **Fechamento de agências**: O fechamento de agências da Caixa está comprometendo o atendimento à população, gerando insatisfação entre os clientes que dependem desses serviços.
3. **Problemas de segurança**: Um caso de golpe por WhatsApp resultou em uma indenização para uma idosa vítima, o que destaca a importância da segurança e da proteção dos clientes da Caixa."
C6,40,55.3,34326775.0,371.0,7347.0,Não informado no período,1ºT/2026,"Aqui estão 3 tópicos curtos sobre as notícias do banco C6, focando no sentimento do cliente e temas principais:

1. **Patrocínio e Expansão**: O C6 Bank está investindo em patrocínios esportivos, como o surfista Yago Dora, e expandindo sua atuação no surfe. Isso pode gerar um sentimento positivo entre os clientes que valorizam ações de responsabilidade social e esportiva.
2. **Inovação e Tecnologia**: O banco está investindo em inteligência artificial (IA) para melhorar a experiência do cliente, com a criação de um assistente virtual que permite ""conversar"" com a fatura do cartão. Isso pode ser visto como um esforço para modernizar e personalizar a interação com os clientes.
3. **Desafios e Reclamações**: No entanto, o C6 Bank também está enfrentando desafios, como liderar o ranking de reclamações do Banco Central no 1º trimestre de 2026. Isso pode gerar um sentimento negativo entre os clientes que estão insatisfeitos com os serviços do banco. É importante que o C6 Bank trabalhe para resolver essas reclamações e melhorar a satisfação do cliente."
BTG Pactual,39,42.81,27389127.0,239.0,7867.0,Não informado no período,1ºT/2026,"Aqui estão 3 tópicos curtos sobre as notícias do banco BTG Pactual, focando no sentimento do cliente e temas principais:

1. **Crescimento e Rentabilidade**: O BTG Pactual apresentou resultados financeiros positivos, com um recorde de lucro e receita, e um Roae (Retorno sobre o Patrimônio Líquido) de 26,6%. Isso pode gerar confiança nos clientes e investidores.
2. **Expansão no Varejo**: O banco está apostando no crescimento das operações de varejo, incluindo o consignado, que pode ser uma grande oportunidade de expansão. Isso pode ser benéfico para os clientes que buscam serviços financeiros mais acessíveis e personalizados.
3. **Fusão e Parcerias**: A aprovação da fusão entre o Banco Pan e o Mosaico, e a negociação com a fintech Meu Tudo, podem indicar uma estratégia de expansão e diversificação do BTG Pactual. Isso pode trazer benefícios para os clientes, como mais opções de serviços e produtos financeiros."
PicPay,40,37.22,68839517.0,514.0,9459.0,Não informado no período,1ºT/2026,"Aqui estão 3 tópicos curtos sobre as notícias do banco PicPay, focando no sentimento do cliente e temas principais:

1. **Desempenho financeiro**: O PicPay apresentou lucro acima do esperado, mas as ações caíram 19% devido à alta inadimplência no último trimestre, o que pode gerar preocupação entre os clientes e investidores.
2. **Reclamações e concorrência**: O PicPay lidera o ranking de reclamações do Banco Central, o que pode afetar a confiança dos clientes. Além disso, o banco enfrenta concorrência acirrada de outros bancos digitais, como o Nubank e o Banco do Brasil.
3. **Inovação e parcerias**: O PicPay está investindo em inovação, com o lançamento de serviços como o ""Modo Seguro"" e a expansão do PicPay Ads, que oferece possibilidades de acompanhamento da jornada do consumidor. Além disso, o banco fechou parcerias importantes, como o patrocínio do Esporte Clube Pinheiros."
Inter,40,34.86,43178240.0,167.0,8097.0,Não informado no período,1ºT/2026,"Aqui estão 3 tópicos curtos sobre as notícias do Banco Inter, focando no sentimento do cliente e temas principais:

1. **Inovação e Tecnologia**: O Banco Inter está investindo em tecnologias inovadoras, como a computação quântica e a custódia de ativos digitais, e lançando produtos como anel, pulseira e relógio para facilitar pagamentos, demonstrando um compromisso com a inovação e a experiência do cliente.
2. **Expansão Internacional**: O Banco Inter recebeu licença para operar uma filial nos Estados Unidos, o que pode expandir as oportunidades de crédito e serviços financeiros para clientes brasileiros e internacionais, melhorando a acessibilidade e a conveniência.
3. **Oportunidades de Crescimento**: A expansão do Banco Inter nos EUA e as inovações tecnológicas podem trazer oportunidades de crescimento e desenvolvimento para o banco e seus clientes, melhorando a percepção e o sentimento dos clientes em relação à marca e aos serviços oferecidos."
