bank,qtd_noticias_recentes,indice_bcb,total_clientes,recl_procedentes,total_respondidas,principal_motivo,periodo,resumo_insight_ia
Itaú,39,34.12,100863694.0,361.0,27703.0,Não informado no período,1ºT/2026,"Aqui estão 3 tópicos curtos sobre as notícias do banco Itaú, focando no sentimento do cliente e temas principais:

1. **Reembolso para clientes**: O Itaú está ressarcindo clientes vítimas de cobranças abusivas, demonstrando um esforço para reparar danos e melhorar a experiência do cliente.
2. **Lançamento de novos produtos**: O banco lançou o cartão Personnalité World Legend, com benefícios como salas VIP ilimitadas e até 5 pontos por dólar, o que pode ser atraente para clientes que buscam produtos de alta qualidade.
3. **Relacionamento com funcionários**: No entanto, o Itaú também está enfrentando críticas por constranger bancários afastados com convocações médicas sucessivas e por encerrar o iCarros PJ, o que pode afetar negativamente o sentimento dos funcionários e, por consequência, a experiência do cliente."
Bradesco,37,48.92,110328071.0,348.0,35387.0,Não informado no período,1ºT/2026,"Aqui estão 3 tópicos curtos sobre as notícias do banco Bradesco, focando no sentimento do cliente e temas principais:

1. **Fechamento de agências**: O Bradesco está fechando agências em algumas cidades, como Otacílio Costa, o que pode gerar preocupação entre os clientes que dependem desses serviços.
2. **Práticas abusivas**: O banco foi autuado pela Decon por práticas abusivas contra consumidores do Ceará, o que pode afetar a confiança dos clientes no banco.
3. **Mudanças nos investimentos**: O Bradesco está reduzindo sua participação na Brava Energia e assumindo o controle da Motiva, o que pode gerar incertezas entre os clientes sobre a estratégia do banco e como isso afetará seus serviços."
Santander,37,34.49,71632364.0,187.0,24301.0,Não informado no período,1ºT/2026,"Aqui estão 3 tópicos curtos sobre as notícias do banco Santander, focando no sentimento do cliente e temas principais:

1. **Controvérsias e críticas**: O banco Santander está enfrentando críticas e controvérsias, incluindo a suspensão de dívidas por decisão judicial e denúncias de demissões em massa, o que pode afetar negativamente a percepção dos clientes sobre a instituição.
2. **Expansão e investimentos**: Por outro lado, o Santander está investindo em sua presença no Brasil, com a inauguração de uma nova sede regional em Fortaleza e a abertura de um programa global de trainee para recém-formados, o que pode ser visto como um sinal de compromisso com o mercado e os clientes.
3. **Estratégias financeiras**: O banco também está tomando medidas para fortalecer sua posição financeira, como a emissão de títulos Tier 1 preferenciais e a indicação de gigantes para sua carteira de dividendos, o que pode ser visto como um sinal de estabilidade e confiança para os investidores e clientes."
Nubank,38,10.65,114737784.0,78.0,31143.0,Não informado no período,1ºT/2026,"Aqui estão 3 tópicos curtos sobre as notícias do Nubank, focando no sentimento do cliente e temas principais:

1. **Desempenho financeiro**: O Nubank enfrenta uma queda de 10% em suas ações em dois dias, além de uma perda de 32% no ano. Isso pode gerar preocupação entre os clientes e investidores.
2. **Inovação e benefícios**: O Nubank lançou uma ferramenta integrada para checar dívidas de outros bancos e uma função para monitorar e renegociar dívidas pelo app. Isso pode ser visto como um benefício para os clientes, ajudando a melhorar sua experiência e gerenciar suas finanças.
3. **Problemas e críticas**: O Nubank enfrenta críticas por falhas em barrar movimentações atípicas, o que levou a um afastamento de dívida de R$ 53 mil e um dano moral de R$ 10 mil. Além disso, a mudança de CFO também gerou perdas para o banco. Isso pode afetar a confiança dos clientes e a percepção da marca."
Caixa,38,23.12,158194617.0,165.0,21753.0,Não informado no período,1ºT/2026,"Aqui estão 3 tópicos curtos resumindo as notícias do banco Caixa, focando no sentimento do cliente e temas principais:

1. **Segurança e Confiabilidade**: O banco Caixa enfrenta problemas de segurança, com ataques hackers que causaram prejuízo de R$ 1,2 bilhão e R$ 20 milhões, o que pode afetar a confiança dos clientes.
2. **Oportunidades de Emprego e Financiamento**: A Caixa está oferecendo oportunidades de emprego com salários atraentes (R$ 8 mil para nível médio) e também disponibilizando canais para renegociação de dívidas, como o Fies, o que pode ser benéfico para os clientes.
3. **Desempenho Financeiro e Negociações**: A Caixa apresentou um lucro contábil de R$ 3,469 bilhões no primeiro trimestre de 2026, mas também está enfrentando críticas e negociações com sindicatos e clientes, o que pode afetar a percepção dos clientes sobre o banco."
C6,38,55.3,34326775.0,371.0,7347.0,Não informado no período,1ºT/2026,"Aqui estão 3 tópicos curtos sobre as notícias do banco C6, focando no sentimento do cliente e temas principais:

1. **Reclamações e Críticas**: O C6 Bank liderou o ranking de reclamações do Banco Central no 1º trimestre de 2026, o que pode indicar insatisfação dos clientes com os serviços oferecidos.
2. **Inovações e Benefícios**: O banco está investindo em tecnologias como IA para engajar clientes e oferecendo benefícios como cashback e renegociação de dívidas de cartão de crédito, o que pode ser visto como positivo pelos clientes.
3. **Soluções e Recuperação**: O C6 Bank também está trabalhando para resolver problemas, como a volta a operar consignado após bloqueio do INSS, e oferecendo soluções como o C6 Tap to Pay e o C6 Invest, o que pode ajudar a melhorar a percepção dos clientes sobre o banco."
BTG Pactual,40,42.81,27389127.0,239.0,7867.0,Não informado no período,1ºT/2026,"Aqui estão 3 tópicos curtos sobre as notícias do banco BTG Pactual, focando no sentimento do cliente e temas principais:

1. **Crescimento e Rentabilidade**: O BTG Pactual apresentou lucro e receita recordes em 2025, com um ROAE de 26,6%. O CEO do banco está confiante em manter um ROE sustentável acima de 25% nos próximos anos, o que pode ser visto como um sinal positivo para os clientes e investidores.
2. **Fusão e Expansão**: A fusão entre o Banco Pan e o Mosaico foi aprovada pelos acionistas, e o CEO do BTG Pactual espera que a rentabilidade do Banco Pan alcance a do grupo até 2028. Isso pode indicar uma expansão dos serviços e produtos oferecidos aos clientes.
3. **Desafios e Críticas**: No entanto, o BTG Pactual também liderou as queixas contra bancos no 1º trimestre, o que pode ser um sinal de insatisfação dos clientes. Além disso, a marca ""Pan"" pode ser substituída, o que pode causar incerteza entre os clientes. É importante que o banco trabalhe para melhorar a experiência do cliente e resolver essas questões."
PicPay,39,37.22,68839517.0,514.0,9459.0,Não informado no período,1ºT/2026,"Aqui estão 3 tópicos curtos sobre as notícias do banco PicPay, focando no sentimento do cliente e temas principais:

1. **Desempenho financeiro**: O PicPay apresentou lucro acima do esperado no primeiro trimestre de 2026, com R$ 169 milhões, mas a alta inadimplência no último trimestre impulsionou uma queda de 19% nas ações do banco na Nasdaq.
2. **Expansão e parcerias**: O PicPay está expandindo suas operações, incluindo um patrocínio com o Esporte Clube Pinheiros e a ampliação de suas possibilidades de publicidade com o PicPay Ads, que acompanha a jornada completa do consumidor.
3. **Desafios regulatórios**: O PicPay está enfrentando desafios regulatórios, incluindo uma investigação do Cade sobre a venda de uma seguradora do Banco Master para o PicPay e uma queixa contra o Itaú sobre carteira digital, o que pode afetar a confiança dos clientes e a reputação do banco."
Inter,40,34.86,43178240.0,167.0,8097.0,Não informado no período,1ºT/2026,"Aqui estão 3 tópicos curtos sobre as notícias do banco Inter, focando no sentimento do cliente e temas principais:

1. **Crescimento de Clientes de Alta Renda**: O banco Inter alcançou 1 milhão de clientes de alta renda, um marco importante para a instituição. Isso demonstra a confiança dos clientes de alta renda no banco e sua capacidade de atender às necessidades desse público.

2. **Inovação em Pagamentos**: O Inter lançou vestíveis de pagamento, como anéis, pulseiras e relógios, para facilitar as transações bancárias. Essa inovação pode ser vista como uma vantagem competitiva e um diferencial para os clientes que buscam conveniência e tecnologia.

3. **Desempenho Financeiro**: O banco Inter apresentou resultados financeiros positivos, com um ROE (Retorno sobre o Patrimônio Líquido) acima de 15% e lucro anual recorde. Isso pode gerar confiança nos clientes e investidores, demonstrando a solidez e estabilidade da instituição."
