bank,qtd_noticias_recentes,indice_bcb,total_clientes,recl_procedentes,total_respondidas,principal_motivo,periodo,resumo_insight_ia
Itaú,230,34.12,100863694.0,361.0,27703.0,Não informado no período,1ºT/2026,"🔹 O Itaú anunciou recentemente uma mudança em sua política de trabalho híbrido, exigindo que os funcionários trabalhem presencialmente por pelo menos três dias por semana a partir de 2028. Essa decisão foi amplamente divulgada pela imprensa, incluindo veículos como Folha de S.Paulo, UOL Economia, Expressão Rondônia e G1. A mudança visa reforçar a interação entre os funcionários e melhorar a produtividade, mas já gerou reações negativas por parte dos bancários, que defendem a manutenção do home office.


🔹 A decisão do Itaú de aumentar o trabalho presencial foi recebida com críticas por parte dos bancários, que argumentam que a medida pode afetar a qualidade de vida e a produtividade dos funcionários. O Sindicato dos Bancários reforçou a defesa do home office e anunciou que entregará uma pauta de reivindicações ao Itaú em 2 de julho. A reação dos bancários destaca a importância de considerar as necessidades e preferências dos funcionários ao tomar decisões sobre a política de trabalho.


🔹 Além da mudança na política de trabalho híbrido, o Itaú também tem sido mencionado em outras notícias recentes, como a redução do preço-alvo do Inter (INTR) de US$ 10 para US$ 8 por parte do Itaú BBA, conforme divulgado pela MSN. Essa notícia não está diretamente relacionada à reputação do Itaú em termos de customer experience, mas demonstra a atuação do banco em diferentes frentes do mercado financeiro."
Bradesco,83,48.92,110328071.0,348.0,35387.0,Não informado no período,1ºT/2026,"🔹 O Bradesco tem apresentado movimentos positivos em termos de dividendos e remuneração aos acionistas, com a liberação de um novo JCP de R$ 3,5 bilhões e o detalhamento do pagamento aos acionistas. Além disso, a aprovação do JCP de R$ 0,35 por ação PN também demonstra a intenção do banco em recompensar seus investidores. Esses movimentos podem contribuir para uma percepção positiva da reputação do Bradesco entre os investidores e acionistas.


🔹 No entanto, o banco também enfrenta desafios em termos de atendimento e segurança, com a instauração de um inquérito civil para apurar o atendimento em uma agência em Cassilândia e a necessidade de ressarcir e indenizar um idoso que perdeu quase R$ 60 mil após um golpe telefônico. Esses incidentes podem afetar negativamente a percepção da reputação do Bradesco em termos de atendimento e segurança.


🔹 Em um contexto mais amplo, o Bradesco também tem se destacado por suas iniciativas de recrutamento e desenvolvimento de talentos, com a abertura de centenas de vagas e a realização de seleções para emprego. Além disso, a revogação da suspensão de oferta pública de fundo do Bradesco pela CVM também pode ser vista como um movimento positivo para a reputação do banco. Esses esforços podem contribuir para uma percepção positiva da reputação do Bradesco em termos de responsabilidade social e desenvolvimento de carreira."
Santander,78,34.49,71632364.0,187.0,24301.0,Não informado no período,1ºT/2026,"🔹 O banco Santander promoveu um leilão com 214 oportunidades, demonstrando sua atuação no mercado financeiro e buscando atrair novos clientes e investidores. Além disso, o banco anunciou a mudança de sua sede para o prédio da antiga Marisa, encerrando atividades no ""prédio do Banespa"", o que pode ser visto como uma estratégia de reestruturação e modernização de suas operações.

 

🔹 A saída de Ana Paula Vescovi, economista-chefe do Santander Brasil após 7 anos, pode ter impacto na reputação do banco, especialmente em relação à sua capacidade de reter talentos. No entanto, a nomeação de Sandro Sobral para assumir a área de estudos econômicos pode ser vista como uma medida para manter a estabilidade e a continuidade das operações do banco. A saída de Vescovi foi amplamente noticiada, o que pode gerar especulações sobre as razões de sua saída e o impacto em sua carreira.

 

🔹 O Santander também anunciou que prevê gerar mais de 1.000 milhões em valor por meio da inteligência artificial (IA) até 2028 e expandir o acesso a ferramentas de IA para 185 mil colaboradores. Além disso, os representantes dos funcionários do banco entregaram uma minuta de reivindicações específicas ao Santander, o que pode indicar uma busca por melhorias nas condições de trabalho e benefícios. Esses movimentos podem ser vistos como esforços do banco para inovar e melhorar a experiência dos funcionários e clientes."
Nubank,133,10.65,114737784.0,78.0,31143.0,Não informado no período,1ºT/2026,"🔹 O Nubank tem sido destaque em várias notícias recentes, destacando sua posição no mercado financeiro. Por exemplo, após uma queda de 30% em suas ações, investidores globais começaram a ver a ação do Nubank como uma oportunidade atraente para investimento, de acordo com o EuQueroInvestir. Além disso, o Nubank liderou o ranking de principalidade no Brasil pelo segundo ano consecutivo, de acordo com o Meio e Mensagem, mostrando sua força no mercado. Esses movimentos indicam que o Nubank continua a ser uma força significativa no setor financeiro, com potencial para atrair investidores e manter sua posição de liderança.


🔹 Outro ponto importante é a forma como o Nubank está se adaptando às necessidades dos clientes e ao mercado. O banco facilitou a renegociação de dívidas pelo programa Desenrola Brasil 2026, como noticiado pelo Fato Paulista, demonstrando sua preocupação com a saúde financeira dos clientes. Além disso, o Nubank está buscando expandir seus serviços para dominar mais um aspecto do dia a dia dos brasileiros, conforme reportado pelo Seu Dinheiro. Essas ações mostram que o Nubank está comprometido em oferecer soluções financeiras inovadoras e acessíveis, o que pode contribuir positivamente para sua reputação.


🔹 No entanto, o Nubank também enfrenta desafios e críticas. O banco precisará provar ao mercado que a inadimplência não sairá do controle, como destacado pelo Finsiders Brasil. Além disso, a notícia de que o Nubank enviou um alerta aos seus clientes, conforme reportado pelo Diário da Região, pode gerar preocupação entre os clientes. A importância de manter a confiança dos clientes também foi abordada em um artigo do Jornal O Candeeiro, que discute como notificações erradas podem afetar a confiança do consumidor em um banco. Esses pontos destacam a necessidade do Nubank de manter a transparência e a comunicação eficaz com seus clientes para manter uma reputação sólida."
Caixa,66,23.12,158194617.0,165.0,21753.0,Não informado no período,1ºT/2026,"🔹 O banco Caixa tem enfrentado questões relacionadas à transparência e gestão de informações sigilosas, como evidenciado pelas notícias sobre o acesso da Vorcaro a apurações sigilosas de negócios entre a Master e a Caixa, totalizando R$ 500 milhões. Isso levanta preocupações sobre a segurança e privacidade dos dados mantidos pelo banco. Além disso, a área técnica do TCU cobrou explicações sobre uma licitação de publicidade no valor de R$ 760 milhões, o que pode impactar a reputação do banco em termos de gestão de recursos e processos.


🔹 Em um contexto mais positivo, a Caixa tem implementado iniciativas para beneficiar seus clientes e a população em geral. Por exemplo, em parceria com o Banco do Brasil, liberou pagamentos de até R$ 1.621 para milhões de brasileiros em junho, mostrando esforços para apoiar financeiramente a população. Além disso, oferece opções para que beneficiários do Pé-de-Meia possam fazer o dinheiro render mais no Caixa Tem, e permite que usuários do Caixa Tem solicitem crédito de até R$ 800, demonstrando uma abordagem mais inclusiva e de apoio financeiro.


🔹 No âmbito interno e de relações trabalhistas, a Caixa tem enfrentado desafios, como debates sobre condições de trabalho e valorização dos empregados, conforme discutido no 41º Conecef. O evento também resultou na aprovação de um plano de lutas e reivindicações para as empregadas e empregados da Caixa, indicando uma busca por melhorias nas relações de trabalho e condições para os funcionários. Esses esforços refletem a importância da satisfação e engajamento dos funcionários para a reputação e sucesso do banco."
C6,5,55.3,34326775.0,371.0,7347.0,Não informado no período,1ºT/2026,"🔹 O C6 Bank foi recentemente promovido ao segmento S2 pelo Banco Central, o que significa que o banco alcançou um novo patamar de classificação e se igualou a outros bancos digitais como Nubank, XP e Safra. Essa promoção é um indicativo de que o C6 Bank está crescendo e se consolidando no mercado financeiro, demonstrando sua capacidade de atender aos requisitos regulatórios e de gestão de risco do Banco Central.

 

🔹 O C6 Bank também tem se destacado por meio de parcerias e ofertas inovadoras, como a parceria com a Azul que oferece até 120% nas transferências de pontos do Inter, C6 Bank e Coopera. Essa iniciativa visa atrair e reter clientes, oferecendo benefícios exclusivos e melhorando a experiência do usuário. Além disso, o banco anunciou o patrocínio ao surfista Yago Dora, o que pode ser visto como uma estratégia de marketing para aumentar sua visibilidade e atrair um público mais jovem e conectado.

 

🔹 A promoção ao segmento S2 e as parcerias estratégicas podem ter um impacto positivo na reputação do C6 Bank, demonstrando sua capacidade de inovar e se adaptar às necessidades dos clientes. No entanto, é importante que o banco continue a monitorar e melhorar sua operação para evitar reclamações operacionais e manter a confiança dos clientes. A combinação de crescimento, inovação e atenção ao cliente pode contribuir para uma reputação sólida e positiva do C6 Bank no mercado financeiro."
BTG Pactual,23,42.81,27389127.0,239.0,7867.0,Não informado no período,1ºT/2026,"🔹 O BTG Pactual tem sido destaque em notícias recentes devido a movimentos estratégicos e operacionais. Um exemplo é a avaliação do banco sobre a ata do Comitê de Política Monetária (COPOM), considerada ""dovish"", o que não altera o cenário de fim de cortes em 2026. Além disso, o lançamento do Research Ideas, uma nova ferramenta de investimento, demonstra o compromisso do BTG em inovação e suporte aos investidores. Esses movimentos positivos contribuem para a reputação do banco como um player importante no setor financeiro.


🔹 No entanto, o BTG Pactual também está envolvido em notícias que podem afetar negativamente sua reputação. A compra do Digimais, um banco ligado a Edir Macedo, está sob investigação da Polícia Federal devido a suspeitas de fraudes e crimes contra o sistema financeiro. A operação resultou no bloqueio de R$ 670 milhões, o que pode ter impacto nas negociações de compra. Esses desenvolvimentos introduzem um elemento de incerteza e risco para o BTG Pactual.


🔹 Apesar dos desafios, o BTG Pactual recebeu uma recomendação positiva do JPMorgan, que elevou sua classificação para ""overweight"". Isso sugere que, apesar das notícias negativas, o banco ainda é visto como uma opção atraente para investidores. Além disso, a parceria com a Nexus para realizar pesquisas sobre a eleição presidencial e outras questões políticas demonstra a capacidade do BTG de se envolver em iniciativas que transcendem o âmbito financeiro, contribuindo para sua reputação como um ator engajado e informado no mercado."
PicPay,65,37.22,68839517.0,514.0,9459.0,Não informado no período,1ºT/2026,"🔹 O PicPay está envolvido em uma série de investigações e operações que questionam suas práticas operacionais, especialmente em relação a descontos indevidos em folhas de pagamento de servidores do Distrito Federal. Essas investigações incluem a operação do Ministério Público que mira o BRB, o PicPay e a Secretaria de Economia do DF, além de acusações de ""roubo"" do salário de servidores por parte de Nelson Neto. Isso sugere uma necessidade de maior regulação do sistema financeiro, como apontado pelo Sindicato dos Bancários.

 

🔹 Além disso, o PicPay enfrenta críticas por supostos juros extorsivos e mudanças nas regras de consignado que beneficiariam a empresa no Distrito Federal. Um decreto mudou a regra de consignado, o que é visto como um benefício para o PicPay. Essas críticas são acompanhadas por ações coletivas nos EUA que acusam o PicPay de enganar investidores, o que pode afetar a reputação da empresa em um mercado internacional.

 

🔹 Em resposta às críticas e investigações, o PicPay descarta a possibilidade de fraude e afirma que não opera consignado. Além disso, a empresa esclarece que a antecipação de salários é gratuita e que as taxas são opcionais, como informado após a operação do Ministério Público. No entanto, essas declarações precisam ser acompanhadas de ações concretas para recuperar a confiança dos clientes e do mercado, especialmente diante da queda forte das ações da empresa em meio às operações e investigações."
Inter,14,34.86,43178240.0,167.0,8097.0,Não informado no período,1ºT/2026,"🔹 O Banco Inter tem se destacado por suas iniciativas de marketing e parcerias inovadoras, como o patrocínio do game de futebol ""7 a 0"" e a criação de uma conta no fórum do banco pelo ídolo do Atlético, Ronaldinho. Essas ações demonstram a estratégia do banco em se conectar com seu público-alvo de forma criativa e interativa, buscando fortalecer sua presença no mercado e melhorar a experiência do cliente. Além disso, o lançamento de campanhas de indicação para clientes e ofertas especiais, como o desconto de R$ 177 na assinatura do Duo Gourmet no Dia dos Namorados, também refletem a busca do banco em fomentar a lealdade e a satisfação dos clientes.


🔹 Em termos de reputação financeira, o Banco Inter tem sido mencionado em notícias relacionadas à segurança dos investimentos e ao desempenho da ação (INBR32) no mercado. A afirmação de que ""investir no Inter é seguro"" e a análise de um economista-chefe do banco sobre a necessidade de manter o jogo aberto sobre juros diante das incertezas econômicas demonstram a preocupação do banco em transmitir confiança e estabilidade aos investidores. Além disso, a menção a uma ""nova janela promissora"" para a ação do Banco Inter sugere um otimismo em relação ao seu desempenho futuro.


🔹 O Banco Inter também tem se destacado por sua adoção de tecnologias inovadoras, como a realização de Pix no WhatsApp, com 18 mil pessoas utilizando essa funcionalidade. Essa iniciativa demonstra a capacidade do banco em se adaptar às tendências digitais e oferecer soluções práticas e convenientes para os clientes. Além disso, a plataforma de investimentos do banco e a parceria com a Bet365 também refletem a busca em expandir seus serviços e oferecer mais opções aos clientes, contribuindo para a melhoria da experiência de customer experience."
