bank,qtd_noticias_recentes,indice_bcb,total_clientes,recl_procedentes,total_respondidas,principal_motivo,periodo,resumo_insight_ia
Itaú,220,34.12,100863694.0,361.0,27703.0,Não informado no período,1ºT/2026,"🔹 O Itaú reduziu a expectativa de cortes na taxa Selic para 2026, aumentando a projeção para 14%. Isso indica uma mudança na perspectiva econômica do banco, que agora espera uma taxa de juros mais alta e estável nos próximos anos. Essa mudança pode afetar a estratégia de investimento e os produtos financeiros oferecidos pelo banco, refletindo uma visão mais cautelosa sobre a economia.


🔹 O Itaú também está enfrentando desafios operacionais, incluindo a reestruturação do Uniclass, que foi anunciada às vésperas de sua implementação, sem que o banco tivesse definido completamente como ela funcionaria. Além disso, houve incidentes de violência em agências, como no Taquaral, o que reforça a necessidade de melhorias na segurança. A Justiça também proibiu o fechamento de uma agência em Resplendor, mostrando a importância de manter a presença do banco em comunidades locais.


🔹 Em termos de desempenho no mercado, o Itaú teve um desempenho positivo, com o seu papel (ITUB4) avançando na Ibovespa, e o dólar recuando. Além disso, o banco tem sido mencionado em contextos de análise econômica, como no caso da BradSaúde, que pagou seu primeiro JCP como empresa listada, animando o Itaú BBA com a perspectiva de dividendos. Esses movimentos indicam que o Itaú continua a ser uma força importante no setor financeiro, com um desempenho que pode influenciar o mercado como um todo."
Bradesco,100,48.92,110328071.0,348.0,35387.0,Não informado no período,1ºT/2026,"🔹 O Bradesco tem se movido estrategicamente no mercado financeiro e imobiliário, com uma visão otimista sobre o setor imobiliário, considerando-o mais maduro e sem sinais de deterioração do crédito, conforme reportado pelo Valor Econômico. Isso sugere que o banco está confiante na estabilidade e potencial de crescimento desse mercado, o que pode influenciar suas decisões de investimento e crédito. Além disso, o banco tem buscado expandir sua presença em outros setores, como a infraestrutura de mobilidade, com a Bradesco BBI fazendo ofertas para adquirir participação no Grupo Mover e na Motiva, demonstrando um interesse em diversificar seus investimentos.

 

🔹 Em outro frente, o Bradesco tem enfrentado desafios legais, com condenações significativas pelo STJ, incluindo a devolução de R$ 650 milhões por acordo com uma empresa falida, conforme noticiado pelo Economic News Brasil, e mais de R$ 600 milhões em outra ação envolvendo uma construtora falida, como reportado pela Folha de S.Paulo. Essas condenações podem afetar a reputação do banco e ter implicações financeiras, destacando a importância de gestão de riscos e conformidade regulatória. É crucial que o banco aprenda com essas experiências e ajuste suas práticas para minimizar a ocorrência de tais eventos no futuro.

 

🔹 Em termos de responsabilidade social e benefícios aos funcionários, o Bradesco, juntamente com outros bancos, como Caixa, Banco do Brasil e Itaú, decidiu abonar horas durante os jogos da Seleção na Copa do Mundo, como informado pelo Sindicato dos Bancários de Campinas e Região. Além disso, o banco tem oferecido oportunidades de emprego, com 291 vagas disponíveis, conforme divulgado pelo JC Concursos, mostrando um compromisso com o desenvolvimento de carreiras e a atração de talentos. Essas ações contribuem positivamente para a reputação do banco, demonstrando seu comprometimento com a satisfação dos funcionários e com a responsabilidade social."
Santander,88,34.49,71632364.0,187.0,24301.0,Não informado no período,1ºT/2026,"🔹 O Santander realizou um leilão de mais de 215 imóveis com opção de financiamento em até 35 anos, conforme noticiado pela Gazeta de São Paulo. Esse movimento pode ser visto como uma estratégia para estimular a venda de imóveis e oferecer condições atraentes para os compradores, especialmente em um mercado imobiliário competitivo. Além disso, o banco também realizou outro leilão com ofertas em 19 estados, incluindo um apartamento por R$ 34 mil, como reportado pelo UOL Economia.

 

🔹 O Santander está envolvido em uma questão relacionada à cobrança de dívidas de até R$ 10 mil, que pode ser extinta, de acordo com notícias da Banda B. Isso pode ter implicações para a reputação do banco, especialmente se for percebido como uma prática de cobrança agressiva. Por outro lado, o banco também tem se posicionado como um ator importante no mercado financeiro, oferecendo análises e perspectivas sobre o setor de construção e empresas como a Vale, como apontado pelo Guia do Investidor e Estadão.

 

🔹 O Santander está sendo mencionado em investigações relacionadas à fraude na Americanas, com a Polícia Federal mirando executivos e a relação de bancos com a fraude, conforme noticiado por várias fontes, incluindo JOTA, CNN Brasil e G1. Essas notícias podem ter um impacto negativo na reputação do banco, especialmente se forem comprovadas irregularidades ou condutas antiéticas. No entanto, é importante aguardar o desfecho das investigações para ter uma visão mais clara do envolvimento do Santander nesse caso."
Nubank,124,10.65,114737784.0,78.0,31143.0,Não informado no período,1ºT/2026,"🔹 O Nubank enfrentou recentemente instabilidade e dificuldade para enviar e receber Pix, conforme relatado por clientes na sexta-feira (26). Essa questão operacional pode afetar a confiança dos clientes e a reputação do banco, especialmente em um mercado onde a eficiência e a confiabilidade dos serviços financeiros são fundamentais. A capacidade do Nubank de resolver esses problemas de forma rápida e eficaz será crucial para manter a satisfação dos clientes e evitar danos à sua reputação.

 

🔹 O Nubank anunciou que não vai parar de contratar pessoas por causa da inteligência artificial (IA), segundo uma declaração de uma diretora do banco. Além disso, o banco prioriza a ""mentalidade de IA"" nas contratações, o que sugere um foco em inovação e tecnologia. Essa abordagem pode ser vista como positiva, pois demonstra a capacidade do Nubank de adaptar-se às mudanças tecnológicas e investir no desenvolvimento de suas equipes, o que pode contribuir para melhorar a experiência do cliente e a eficiência operacional.

 

🔹 O Nubank também lançou uma linha de crédito extra para pagar boletos e PIX sem afetar o limite do cartão, o que pode ser visto como uma medida para aumentar a flexibilidade e a conveniência para os clientes. Além disso, o banco liderou o ranking de Principalidade no Brasil pelo segundo ano consecutivo, o que indica uma forte presença no mercado e uma boa reputação entre os clientes. Esses movimentos podem contribuir para reforçar a posição do Nubank no setor financeiro e atrair mais clientes."
Caixa,64,23.12,158194617.0,165.0,21753.0,Não informado no período,1ºT/2026,"🔹 O banco Caixa realizou uma renegociação de R$ 5,5 bilhões em dívidas pelo programa Desenrola Brasil, com um desconto médio de 79,3%. Isso demonstra um esforço da instituição para ajudar os clientes a regularizarem suas dívidas, melhorando a experiência do cliente e a reputação do banco. A iniciativa pode atrair mais clientes e aumentar a confiança na marca.

 

🔹 A Caixa também está envolvida em negociações com o sindicato dos trabalhadores do setor financeiro, CONTEC, que entregou uma pauta de reivindicações para a Campanha Salarial 2026. Essas negociações são cruciais para manter a motivação e a satisfação dos funcionários, o que, por sua vez, reflete positivamente na experiência do cliente e na reputação do banco. A capacidade da Caixa de lidar com essas negociações de forma justa e satisfatória pode impactar sua imagem pública.

 

🔹 Além disso, a Caixa Econômica Federal realizou o pagamento do Bolsa Família para beneficiários com NIS final 8 e liberou um novo lote de dinheiro esquecido do PIS/Pasep, permitindo que milhares de brasileiros possam sacar seus recursos. Essas ações demonstram o compromisso do banco com a responsabilidade social e a eficiência em serviços públicos, contribuindo para uma reputação positiva e reforçando a confiança dos clientes e da sociedade em geral na instituição."
C6,5,55.3,34326775.0,371.0,7347.0,Não informado no período,1ºT/2026,"🔹 O C6 Bank tem se destacado recentemente por sua estratégia de expansão e melhoria de serviços, como o aumento da pontuação de cartão, o que visa atrair e reter clientes de altíssima renda. Isso indica um esforço do banco para se posicionar competitivamente no mercado financeiro, especialmente em relação a benefícios e recompensas para seus clientes. Além disso, a ampliação da disputa pela altíssima renda sugere que o C6 Bank está buscando aumentar sua participação nesse nicho de mercado lucrativo.


🔹 O C6 Bank também tem sido mencionado em parcerias e ofertas especiais com outras empresas, como a Azul, que oferece até 120% nas transferências de pontos do Inter, C6 Bank e Coopera. Essas parcerias demonstram a capacidade do banco de formar alianças estratégicas que beneficiam seus clientes e expandem sua presença no mercado. Isso pode contribuir positivamente para a reputação do C6 Bank, mostrando sua habilidade em criar valor para os clientes através de oportunidades exclusivas.


🔹 A promoção do C6 Bank para o segmento S2 pelo Banco Central é um marco significativo, colocando-o em igualdade com instituições financeiras como Nubank, XP e Safra. Essa classificação reflete a solidez e o crescimento do C6 Bank, indicando que atende a critérios rigorosos de estabilidade financeira e gestão de riscos. Essa promoção pode aumentar a confiança dos investidores e dos clientes na capacidade do banco de operar em um nível mais alto de complexidade e responsabilidade."
BTG Pactual,44,42.81,27389127.0,239.0,7867.0,Não informado no período,1ºT/2026,"🔹 O BTG Pactual tem se destacado com análises e previsões otimistas sobre o setor de frigoríficos e empresas como a Vibra e a Ultrapar, apontando para um crescimento significativo em seus balanços e desempenho no mercado. Isso indica uma postura proativa do banco em relação ao mercado de investimentos, buscando oportunidades de crescimento para seus clientes e investidores. Além disso, o banco tem se posicionado como um player importante no setor de franquias, com a participação na ABF Franchising Expo 2026 e a oferta de soluções financeiras específicas para franqueados e franqueadores.


🔹 O BTG Pactual também tem estado no centro de especulações sobre a possível aquisição do banco Digimais, que foi alvo de uma operação da Polícia Federal. Embora o banco tenha esclarecido rumores e não descartado a possibilidade de compra, ainda não há uma confirmação oficial sobre sua participação no processo. Essa movimentação sugere que o BTG Pactual está em constante busca por oportunidades de expansão e consolidação no mercado financeiro, mas também enfrenta desafios e especulações que podem afetar sua reputação.


🔹 A expansão do BTG Pactual no setor de franquias, com um mercado potencial de R$ 300 bilhões, é outro movimento estratégico que destaca a busca do banco por diversificar suas operações e oferecer soluções financeiras inovadoras para diferentes segmentos. A participação na ABF Franchising Expo 2026 e a oferta de soluções de crédito, recebíveis e gestão financeira para franqueados e franqueadores reforçam a posição do banco como um parceiro financeiro relevante para esse setor em crescimento."
PicPay,73,37.22,68839517.0,514.0,9459.0,Não informado no período,1ºT/2026,"🔹 O PicPay tem enfrentado desafios recentes, incluindo uma ""class action"" e investigações, mas conseguiu se recuperar na bolsa. Isso ocorre apesar das notícias negativas, como a exposição de falhas na fiscalização e descontos indevidos em folha de pagamento, que têm levantado questões sobre a regulamentação do sistema financeiro e a proteção dos consumidores. Além disso, o banco tem sido alvo de críticas de figuras públicas, como Nelson Neto, que classificou os descontos do PicPay como ""roubo"" do salário de servidores do DF.


🔹 Em um movimento para expandir seus serviços, o PicPay liberou ações e fundos imobiliários no aplicativo, permitindo que os usuários invistam em diferentes ativos. No entanto, é importante questionar se esses investimentos são vantajosos para os clientes, considerando as taxas e os riscos envolvidos. Além disso, o PicPay também registrou uma alta de 60% em usuários de agregador de ativos, o que pode indicar um crescimento no interesse dos clientes por investimentos diversificados.


🔹 A crise no PicPay também tem sido objeto de análise, com alguns especialistas argumentando que o ""ruído"" em torno da empresa pode estar obscurecendo o ""sinal"" de que o banco está trabalhando para melhorar sua oferta de serviços e expandir sua presença no mercado. No entanto, as notícias sobre investigações e sanções continuam a afetar a reputação do PicPay, e é fundamental que a empresa adote medidas para recuperar a confiança dos clientes e do mercado."
Inter,13,34.86,43178240.0,167.0,8097.0,Não informado no período,1ºT/2026,"🔹 O Banco Inter tem se destacado nos mercados financeiros com seu desempenho em produtos de renda fixa e na negociação de BDRs (Brazilian Depositary Receipts) na B3. Em maio, o banco liderou as negociações de BDRs, demonstrando sua força no mercado de capitais. Além disso, a estratégia do banco para lucrar com a ""virada"" na renda fixa, apontada em uma reportagem do Valor Investe, sugere que o Inter está se posicionando para aproveitar as oportunidades de investimento de longo prazo, o que pode atrair mais investidores e reforçar sua posição no mercado.

 

🔹 No entanto, o banco também enfrenta desafios, como a redução do preço-alvo por parte do Itaú BBA, que cortou sua previsão de lucro para o Inter neste ano. Isso pode refletir incertezas sobre o desempenho futuro do banco ou ajustes nos mercados financeiros. Por outro lado, o Inter recebeu cobertura positiva em relação à segurança dos investimentos, com artigos na CNN Brasil destacando a proteção dos investidores e o banco como uma opção segura para investir.

 

🔹 Além disso, o Banco Inter tem buscado diversificar sua presença e engajamento com diferentes públicos, como demonstrado pelo patrocínio do game de futebol ""7 a 0"", que ganhou popularidade na internet. Essa iniciativa pode ajudar a melhorar a percepção do banco entre os mais jovens e os entusiastas de esportes, contribuindo para uma imagem mais positiva e moderna da instituição financeira."
