bank,qtd_noticias_recentes,indice_bcb,total_clientes,recl_procedentes,total_respondidas,principal_motivo,periodo,resumo_insight_ia
Itaú,101,34.12,100863694.0,361.0,27703.0,Não informado no período,1ºT/2026,"🔹 O Itaú Unibanco está envolvido em várias notícias recentes que afetam sua reputação. Uma delas é a decisão que permite que bancos como o Itaú bloqueiem contas de devedores, o que pode ser visto como uma medida para reduzir as perdas financeiras, mas também pode afetar negativamente a percepção dos clientes em relação ao banco. Além disso, o Itaú foi punido por cobranças indevidas e terá que ressarcir clientes em todo o país, o que pode danificar a confiança dos clientes no banco.

 

🔹 Outro ponto importante é a iniciativa do Itaú em relação aos seus funcionários, como a decisão de liberar bancários nos jogos da Seleção sem compensação de horas, o que pode ser visto como uma medida para melhorar a qualidade de vida dos funcionários. Além disso, o Itaú está investindo em marketing e inovação, como a reformulação do conceito de estande na Arena Itaú e a transformação do jingle ""Mostra Tua Força Brasil"" em plataforma interativa para a Copa 2026, o que pode ajudar a melhorar a percepção da marca.

 

🔹 Por fim, é importante destacar que o Itaú também está envolvido em notícias positivas, como a liderança no ranking das Marcas Mais Valiosas do Brasil pelo 10º ano consecutivo, segundo a Forbes Brasil. Além disso, o banco está oferecendo benefícios aos clientes, como o benefício de R$ 300 direto na conta, o que pode ajudar a melhorar a satisfação dos clientes e a reputação do banco. No entanto, o Itaú também está enfrentando desafios, como a convocação para explicar dívida de R$ 19 bilhões em impostos, o que pode afetar negativamente a percepção da marca."
Bradesco,35,48.92,110328071.0,348.0,35387.0,Não informado no período,1ºT/2026,"🔹 O Bradesco anunciou o fechamento de agências em Cajazeiras e Rio Vermelho, em Salvador, como parte de uma estratégia de reestruturação e otimização de seus canais de atendimento. Isso significa que cerca de 11 mil clientes serão transferidos para outras unidades, como o Porto Seco Pirajá, e a agência do Rio Vermelho será transformada em um escritório de negócios, sem caixas. Essa mudança pode afetar a experiência do cliente, especialmente para aqueles que dependem de serviços presenciais.

 

🔹 O Bradesco também tem se destacado por investir em tecnologia e inovação, com o lançamento de processos seletivos para contratação de profissionais em áreas como tecnologia, negócios e estratégias. Além disso, a instituição financeira tem parcerias com empresas como a Totvs para gerenciar pontos eletrônicos, demonstrando um esforço para modernizar seus processos e melhorar a eficiência. Esses movimentos podem contribuir para uma reputação positiva do banco em termos de inovação e capacidade de adaptação às mudanças do mercado.

 

🔹 No entanto, o Bradesco também enfrenta desafios e críticas, como a vitória do sindicato contra o banco em uma disputa histórica, conforme noticiado pela FEEB PR. Além disso, a instituição financeira tem enfrentado reclamações operacionais e sanções, o que pode afetar negativamente sua reputação. Por exemplo, a mudança na agência do Rio Vermelho, que deixará de ter caixas, pode ser vista como uma redução nos serviços oferecidos aos clientes. É importante que o Bradesco monitore esses desafios e trabalhe para melhorar a experiência do cliente e manter uma reputação positiva no mercado."
Santander,42,34.49,71632364.0,187.0,24301.0,Não informado no período,1ºT/2026,"🔹 O Santander realizou um leilão de imóveis com lances a partir de R$ 30,6 mil, oferecendo 198 oportunidades de imóveis. Esse movimento pode ser visto como uma estratégia para recuperar créditos e reduzir o estoque de imóveis não vendidos, melhorando a saúde financeira do banco. Além disso, o leilão pode atrair novos clientes e aumentar a visibilidade do banco no mercado imobiliário.


🔹 O Santander está enfrentando desafios relacionados à reputação, incluindo a denúncia de 11 suspeitos de causar prejuízo de R$ 8,2 milhões ao banco, conforme divulgado pela MPRJ. Além disso, o banco foi acusado de tentar calar a voz dos associados da Cabesp, o que pode afetar negativamente a percepção pública do banco. Esses incidentes podem ser vistos como um risco para a reputação do Santander e exigem uma resposta eficaz para minimizar os danos.


🔹 O Santander também está se destacando em iniciativas positivas, como a antecipação do reembolso de 400 milhões em obrigações pela Santander Totta, o que demonstra a capacidade do banco de gerenciar suas obrigações financeiras de forma eficaz. Além disso, a presença do Santander no Brasil foi destacada no projeto ""Portugal Nação Global"", que visa ligar empresários da diáspora ao tecido empresarial português, mostrando o compromisso do banco com a comunidade e o desenvolvimento econômico."
Nubank,101,10.65,114737784.0,78.0,31143.0,Não informado no período,1ºT/2026,"🔹 O Nubank recentemente enfrentou uma crise de reputação devido a um alerta falso de liquidação enviado a seus clientes. De acordo com as notícias, o erro ocorreu quando um desenvolvedor acionou por engano um comando que enviou a mensagem sobre liquidação extrajudicial. A empresa atribuiu o erro a um problema técnico interno e não a uma falha no sistema de comunicação em si. A cofundadora do Nubank, Cristina Junqueira, classificou o erro como ""bizarro"" e pediu desculpas aos clientes.


🔹 Além do erro técnico, o Nubank também enfrentou questionamentos sobre por que havia um e-mail pronto sobre liquidação extrajudicial. De acordo com a empresa, o e-mail foi preparado como uma medida de precaução, mas não foi destinado a ser enviado aos clientes. A explicação do Nubank foi que o e-mail foi criado como parte de um protocolo interno para lidar com situações de crise, mas não foi ativado corretamente.


🔹 A crise de reputação do Nubank também levantou questões sobre a transparência e a comunicação da empresa com seus clientes. A empresa foi criticada por não ter esclarecido imediatamente o que havia ocorrido e por não ter fornecido informações suficientes sobre o erro. No entanto, a cofundadora Cristina Junqueira pediu desculpas públicas e a empresa comprometeu-se a melhorar sua comunicação e evitar erros semelhantes no futuro."
Caixa,34,23.12,158194617.0,165.0,21753.0,Não informado no período,1ºT/2026,"🔹 O banco Caixa está enfrentando desafios relacionados à segurança dos seus clientes, com a ocorrência de golpes, como o novo golpe do Caixa Tem, que levou a instituição financeira a emitir um alerta aos clientes. Além disso, a Caixa também está lidando com investigações sobre fraudes contra a instituição, com a Polícia Federal cumprindo mandados em uma investigação sobre o assunto. Esses eventos podem afetar a reputação da Caixa em termos de segurança e confiabilidade.


🔹 A Caixa também está envolvida em iniciativas que visam melhorar a vida dos brasileiros, como o lançamento de um super aplicativo que irá simplificar o acesso a serviços como FGTS, Bolsa Família e Caixa Tem. Além disso, a instituição financeira também está administrando um fundo imobiliário da União, anunciado pela ministra. Essas iniciativas podem contribuir para uma reputação positiva da Caixa em termos de inovação e compromisso social.


🔹 No entanto, a Caixa também está enfrentando desafios relacionados à sua atuação no mercado, como o processo contra a instituição por abuso no mercado de bolões, que está entrando na fase final. Além disso, a Caixa também está lidando com a oposição de outros bancos a um plano da Ambipar que prioriza credor externo. Esses eventos podem afetar a reputação da Caixa em termos de competitividade e conformidade regulatória."
C6,4,55.3,34326775.0,371.0,7347.0,Não informado no período,1ºT/2026,"🔹 O C6 Bank foi recentemente promovido ao segmento S2 pelo Banco Central, o que significa que o banco agora se encontra na segunda maior categoria do país. Isso indica um crescimento significativo na instituição financeira, refletindo sua estabilidade e capacidade de atender a um público mais amplo. A promoção ao segmento S2 é um reconhecimento da solidez do C6 Bank e de sua capacidade de operar em um nível mais elevado, o que pode atrair mais clientes e investidores.

 

🔹 O C6 Bank também anunciou um patrocínio ao surfista Yago Dora, o que demonstra a estratégia do banco de se aproximar de esportes e atividades que são populares entre os jovens e os entusiastas de esportes radicais. Essa parceria pode ajudar a melhorar a imagem do banco e a aumentar sua visibilidade entre o público mais jovem, que é um mercado-alvo importante para as instituições financeiras. Além disso, o patrocínio ao surfista pode ser visto como uma forma de promover a cultura e o esporte no Brasil.

 

🔹 Além disso, o C6 Bank também publicou informações sobre datas importantes, como o quinto dia útil de junho de 2026, o que demonstra a preocupação do banco em manter seus clientes informados sobre datas relevantes para operações financeiras. Essa iniciativa pode ser vista como uma forma de melhorar a experiência do cliente e de demonstrar a transparência e a comunicação eficaz do banco. Isso pode contribuir para aumentar a confiança dos clientes e melhorar a reputação do C6 Bank no mercado."
BTG Pactual,0,42.81,27389127.0,239.0,7867.0,Não informado no período,1ºT/2026,🔹 Sem fatos relevantes ou menções críticas mapeadas na mídia para esta instituição no mês vigente.
PicPay,4,37.22,68839517.0,514.0,9459.0,Não informado no período,1ºT/2026,"🔹 O banco PicPay enfrentou uma queda significativa de 19% após o primeiro trimestre de 2026, o que representa uma perda de 52% desde o IPO. Isso pode indicar uma perda de confiança dos investidores na capacidade do banco de competir com outros players no mercado, como o Nubank. Além disso, o lançamento de um novo serviço pelo Banco do Brasil pode aumentar a concorrência e pressionar ainda mais o desempenho do PicPay.


🔹 Por outro lado, o PicPay superou as expectativas de guidance e reforçou sua aposta no consignado privado, o que pode ser um sinal positivo para a reputação do banco. Isso sugere que o banco está trabalhando para melhorar sua oferta de serviços e atrair mais clientes, o que pode ajudar a recuperar a confiança dos investidores e melhorar sua posição no mercado.


🔹 O PicPay também fechou um patrocínio máster com o Esporte Clube Pinheiros para o basquete, o que pode ser visto como uma estratégia de marketing para aumentar a visibilidade e a reputação do banco. Essa parceria pode ajudar a atrair mais clientes e melhorar a percepção do banco como uma instituição financeira inovadora e comprometida com a comunidade."
Inter,22,34.86,43178240.0,167.0,8097.0,Não informado no período,1ºT/2026,"🔹 O Banco Inter tem feito movimentos estratégicos para expandir sua presença no mercado, incluindo a oferta de R$ 177 OFF na assinatura do Duo Gourmet - Pontos pra Voar durante o Dia dos Namorados, o que pode atrair novos clientes e fortalecer a fidelidade dos existentes. Além disso, a instituição financeira também tem explorado o potencial do pagamento via WhatsApp, com 18 mil pessoas realizando Pix por essa plataforma, o que demonstra a capacidade do banco em se adaptar às tendências tecnológicas e oferecer soluções inovadoras para seus clientes.

 

🔹 O desempenho financeiro do Banco Inter também tem sido objeto de análise, com resultados no 4T25 mostrando um ROE acima de 15% e um lucro anual recorde, o que indica uma gestão eficaz e uma estratégia de crescimento bem-sucedida. No entanto, a incorporação de ativos do BMG (BMGB4) levou a uma queda nas ações do Banco Inter, o que pode ser um desafio para a instituição em manter a confiança dos investidores. Ainda assim, especialistas como o BTG veem potencial de alta para a ação, especialmente após uma queda de 30% no desempenho de small cap.

 

🔹 O Banco Inter também tem se destacado por sua abordagem inovadora em relação às tecnologias emergentes, como a computação quântica e a custódia de ativos digitais, incluindo o Bitcoin. A instituição financeira promoveu um debate sobre esses temas, demonstrando seu compromisso em entender e se adaptar às mudanças no mercado. Além disso, o lançamento de acessórios como anel, pulseira e relógio para facilitar pagamentos é mais um exemplo da capacidade do Banco Inter em inovar e oferecer soluções práticas e convenientes para seus clientes."
