bank,qtd_noticias_recentes,indice_bcb,total_clientes,recl_procedentes,total_respondidas,principal_motivo,periodo,resumo_insight_ia
Itaú,225,34.12,100863694.0,361.0,27703.0,Não informado no período,1ºT/2026,"🔹 O Itaú Unibanco tem enfrentado desafios legais e operacionais recentemente, incluindo uma condenação por desconto de consórcio de moto em aposentadoria, conforme noticiado pelo Diário do Centro do Mundo. Além disso, o banco foi alvo de uma CPI em São Paulo devido a uma dívida bilionária de impostos, como reportado pela Transmissão Política. Esses eventos podem afetar a reputação do banco e sua relação com os clientes e órgãos reguladores.


🔹 Em um contexto mais positivo, o Itaú tem investido em tecnologia e inovação, com destaque para o uso de inteligência artificial (IA) para apoiar pequenos empreendedores, como destacado pelo TI INSIDE Online. Além disso, o desempenho financeiro do banco também tem sido notável, com um aumento significativo no valor das ações nos últimos 10 anos, como reportado pelo Money Times. Esses aspectos podem contribuir para uma percepção mais favorável do banco no mercado.


🔹 No entanto, o Itaú também tem enfrentado questões operacionais e de comunicação com os clientes, como a pane no Pix que afetou o banco e o Nubank, conforme noticiado pelo Tecnoblog. Além disso, a decisão de acabar com um de seus cartões de crédito e a necessidade de emitir alertas oficiais para os clientes, como reportado pelo Portal Tempo Novo, podem gerar incertezas e impactar a confiança dos clientes no banco."
Bradesco,79,48.92,110328071.0,348.0,35387.0,Não informado no período,1ºT/2026,"🔹 O Bradesco lançou duas campanhas publicitárias com o cantor Michel Teló, criadas pela agência AlmapBBDO, com o objetivo de promover os produtos e serviços do banco, especialmente no segmento de agro e empresas. Essas campanhas fazem parte de uma estratégia cross-narrativa, visando aumentar a presença do banco nesses mercados e reforçar sua imagem junto ao público-alvo. A parceria com Michel Teló, uma figura conhecida e respeitada no Brasil, especialmente no meio rural, pode contribuir para o aumento da visibilidade e da reputação do Bradesco nesses setores.


🔹 O Bradesco anunciou mudanças em sua liderança no setor de crédito rural, com a nomeação de uma nova líder para o E-agro, plataforma do banco dedicada a soluções financeiras para o agronegócio. Essa mudança visa ampliar a presença digital do banco no crédito rural, oferecendo soluções mais adequadas às necessidades dos produtores rurais e contribuindo para o crescimento sustentável do setor. A nomeação de uma nova liderança pode indicar um renovado foco do Bradesco em inovação e expansão nesse mercado.


🔹 O Bradesco também está lançando novos produtos, como o cartão Visa Infinite em dólar, que oferece acúmulo de pontos e acesso a salas VIP, visando atender às necessidades de clientes que realizam transações internacionais. Além disso, o banco participou do 4º leilão do Eco Invest, selecionando um ""pipeline realista"" na Amazônia, o que pode ser visto como um esforço para investir em projetos sustentáveis e contribuir para a conservação ambiental. No entanto, o banco também enfrenta desafios, como o protesto em Cajazeiras contra o fechamento de uma agência, o que pode afetar negativamente sua reputação em algumas comunidades."
Santander,100,34.49,71632364.0,187.0,24301.0,Não informado no período,1ºT/2026,"🔹 O Santander tem se destacado por suas iniciativas de educação e desenvolvimento de habilidades, como o lançamento de 10 mil vagas gratuitas para um Bootcamp de Power BI e Inteligência Artificial em parceria com a Universia. Essa ação demonstra o compromisso do banco em investir no desenvolvimento de competências digitais e na capacitação de profissionais, contribuindo para a formação de uma força de trabalho mais qualificada e apta a lidar com as demandas do mercado atual.


🔹 O banco também tem se envolvido em ações de marketing e patrocínio, como a instalação de um capacete gigante com contagem regressiva para o GP de São Paulo de Fórmula 1. Essa iniciativa visa aumentar a visibilidade do Santander e reforçar sua presença no mercado, especialmente entre os fãs de esportes e entretenimento. Além disso, o banco tem sido mencionado em notícias relacionadas a eventos esportivos e culturais, como o Santander Track&Field Run Series em Ribeirão Preto.


🔹 No entanto, o Santander também tem enfrentado desafios e críticas, como a rebaixada da recomendação para a ação da JBS devido ao ciclo negativo da carne nos EUA até 2028. Além disso, o banco tem sido mencionado em notícias relacionadas a negociações sindicais, como a entrega de pauta de reivindicações pela CONTEC durante a Campanha Salarial 2026. Esses pontos demonstram a complexidade do ambiente financeiro e a necessidade do Santander de navegar por desafios regulatórios, econômicos e sociais para manter sua reputação e sucesso no mercado."
Nubank,61,10.65,114737784.0,78.0,31143.0,Não informado no período,1ºT/2026,"🔹 O Nubank enfrentou recentemente uma série de instabilidades em seu sistema, levando a reclamações de clientes que relataram dificuldades para realizar transações via Pix, receber Pix e até mesmo problemas com a disponibilidade de saldos. Essas instabilidades foram amplamente noticiadas e geraram preocupação entre os usuários do banco digital, que esperam uma experiência suave e confiável. Além disso, a cobrança de serviços que antes eram gratuitos, como o anúncio de que o Nubank Ultravioleta vai cobrar pelo HBO Max, pode afetar a percepção dos clientes sobre a relação custo-benefício do banco.

 

🔹 Outro ponto de atenção é a notificação recebida do Banco Central, que pode levar a mudanças significativas para os clientes do Nubank. Embora os detalhes específicos da notificação não tenham sido divulgados, é importante que o Nubank comunique claramente com seus clientes sobre quaisquer alterações que possam afetar seus serviços ou produtos. A transparência e a comunicação eficaz são fundamentais para manter a confiança dos clientes e proteger a reputação do banco.

 

🔹 Em meio às notícias sobre instabilidades e possíveis mudanças, o Nubank também anunciou novas condições de benefício da HBO Max para clientes Plus e Ultravioleta, o que pode ser visto como um esforço para manter e atrair clientes. No entanto, a percepção geral da reputação do Nubank depende da capacidade do banco de equilibrar a oferta de serviços atraentes com a estabilidade e confiabilidade de suas operações. A forma como o Nubank lida com esses desafios e comunica com seus clientes será crucial para manter uma reputação positiva no mercado."
Caixa,77,23.12,158194617.0,165.0,21753.0,Não informado no período,1ºT/2026,"🔹 O banco Caixa tem enfrentado negociações salariais com sindicatos de bancários, com reuniões agendadas para discutir a campanha salarial. Além disso, o sindicato também discute a ação do auxílio-alimentação da CAIXA, mostrando a atenção do banco em melhorar as condições de trabalho e benefícios para seus funcionários. Essas negociações são importantes para manter a reputação do banco como um empregador justo e preocupado com o bem-estar de seus colaboradores.


🔹 A Caixa Econômica Federal tem alcançado marcos importantes em termos de financiamentos imobiliários, ultrapassando a marca de R$ 1 trilhão. Isso demonstra a confiança dos clientes no banco e sua capacidade de oferecer soluções financeiras adequadas para o mercado. Além disso, o banco também tem tomado decisões surpreendentes, como deixar de oferecer cartões de crédito da bandeira Mastercard, o que pode afetar a percepção dos clientes sobre a oferta de produtos do banco.


🔹 O banco Caixa também tem realizado ações para beneficiar diretamente os clientes, como a liberação de valor acima de R$ 600 para alguns brasileiros com conta ativa até 31 de julho através do Caixa Tem, e a liberação de dinheiro extra do FGTS para trabalhadores em agosto. Essas ações demonstram a preocupação do banco em oferecer benefícios e soluções financeiras para seus clientes, melhorando sua reputação e relação com o público."
C6,4,55.3,34326775.0,371.0,7347.0,Não informado no período,1ºT/2026,"🔹 O C6 Bank tem se destacado por suas estratégias inovadoras no setor financeiro, como pode ser visto na biografia de seu fundador, Marcelo Kalim, que trouxe experiências valiosas de sua carreira no BTG Pactual. Isso reflete a capacidade do banco de atrair talentos e construir uma equipe sólida, o que é fundamental para o sucesso em um mercado competitivo. A fundação do C6 Bank por Marcelo Kalim é um exemplo de como a visão e a experiência de um líder podem impulsionar o crescimento de uma instituição financeira.

 

🔹 Em relação a investimentos, o C6 Bank tem oferecido recomendações para 2026, considerando a queda nos juros. Isso demonstra a capacidade do banco de se adaptar às condições econômicas atuais e oferecer soluções personalizadas para seus clientes. A capacidade de proporcionar orientação de investimento eficaz é crucial para manter a confiança dos clientes e atrair novos investidores, especialmente em um cenário de incerteza econômica.

 

🔹 O C6 Bank também tem feito movimentos estratégicos para ampliar sua participação no mercado, como o aumento da pontuação de cartão e a disputa pela clientela de altíssima renda. Essas ações indicam uma abordagem proativa para conquistar uma fatia maior do mercado e atrair clientes de alto valor. Ao aumentar a pontuação de cartão, o banco oferece mais benefícios e recompensas, tornando-se mais atraente para os clientes que buscam vantagens exclusivas, o que pode contribuir para a melhoria de sua reputação e lealdade do cliente."
BTG Pactual,59,42.81,27389127.0,239.0,7867.0,Não informado no período,1ºT/2026,"🔹 O BTG Pactual revisou suas projeções econômicas, indicando que a taxa Selic pode cair mais em 2026, mas mantém uma postura cautelosa devido à inflação e ao valor do dólar. Isso sugere que o banco está monitorando de perto os indicadores econômicos e ajustando suas previsões conforme necessário. Além disso, o BTG Pactual também elevou sua projeção para o valor do dólar no fim de 2026, passando de R$ 4,90 para R$ 5,40, o que pode impactar as decisões de investimento e as estratégias de negócios das empresas e investidores.


🔹 O BTG Pactual tem se destacado por suas recomendações de investimento e análises de mercado, incluindo a recomendação de compra de ações da SpaceX, com um preço-alvo de quase US$ 1.000. Isso demonstra a confiança do banco na capacidade da empresa de crescer e se consolidar no mercado. Além disso, o BTG Pactual também divulgou sua lista de 10 ações favoritas entre as small caps para julho, oferecendo orientação aos investidores que buscam oportunidades em empresas menores.


🔹 O BTG Pactual está investindo em iniciativas para expandir sua presença no mercado e melhorar a experiência dos clientes, incluindo o lançamento de uma solução de pagamentos para empresas através do BTG Pactual Empresas. Além disso, o banco também abriu inscrições para um programa de formação de assessores de investimento, demonstrando seu compromisso com o desenvolvimento de talentos e a melhoria dos serviços oferecidos aos clientes. Essas iniciativas podem contribuir para a melhoria da reputação do banco e a consolidação de sua posição no setor financeiro."
PicPay,10,37.22,68839517.0,514.0,9459.0,Não informado no período,1ºT/2026,"🔹 O PicPay tem enfrentado desafios recentemente, com notícias sobre crises de confiança e investigações. O caso mais notável é a menção ao PicPay em uma crise de confiança que envolve outros bancos, como o Master e o Digimais, destacando falhas na fiscalização e possíveis irregularidades. Além disso, o PicPay está sob investigação por parte do MPDFT em relação à folha de servidores, o que pode afetar sua reputação e confiabilidade no mercado.


🔹 Apesar dos desafios, o PicPay também tem apresentado movimentos positivos, como o lançamento de novas funcionalidades e produtos. Por exemplo, o aplicativo agora oferece ações e fundos imobiliários, o que pode atrair novos investidores e expandir sua base de usuários. Além disso, o PicPay tem visto um aumento de 60% em usuários de agregador de ativos, o que sugere que a plataforma está se tornando mais atraente para investidores.


🔹 Em termos de mercado e financeiro, o PicPay tem apresentado resultados mistos. As ações do PicPay disparam em Wall Street após a Citi iniciar cobertura com recomendação de compra, o que é um sinal positivo para a empresa. No entanto, o PicPay também enfrentou uma queda de 50% em seu valor, o que pode ser um sinal de instabilidade no mercado. Além disso, a empresa está sob ""class action"" e investigação, o que pode afetar sua reputação e valor no mercado."
Inter,18,34.86,43178240.0,167.0,8097.0,Não informado no período,1ºT/2026,"🔹 O Banco Inter tem apostado em inovações e expansão de serviços, como a criação de uma plataforma de ads integrada ao Super App, visando fortalecer sua presença no mercado de Retail Media. Isso demonstra a estratégia do banco em diversificar suas ofertas e explorar novas fontes de receita, potencialmente atraindo mais clientes e aumentando sua competitividade no setor financeiro.


🔹 O desempenho financeiro do Banco Inter também tem sido noticiado, com o fechamento do primeiro trimestre com um lucro de R$ 395 milhões e R$ 50 bilhões em crédito. Além disso, o CEO do banco destacou que o volume de receitas tem compensado a inadimplência, indicando uma gestão financeira sólida e capacidade de lidar com desafios econômicos. Esses resultados positivos podem influenciar a percepção dos investidores e da comunidade financeira sobre a saúde e a estabilidade do banco.


🔹 No entanto, o Banco Inter também enfrentou desafios, como instabilidade no aplicativo relatada por clientes e a entrega de pauta de reivindicações específicas pelo sindicato dos bancários. Além disso, o banco anunciou um programa de recompra de ações, mas as ações fecharam em queda. Por outro lado, o programa de Customer Experience (CX) do banco parece ter tido um impacto positivo, melhorando a posição do Inter no Ranking de Reclamações do BC, o que pode contribuir para uma melhora na reputação do banco junto aos clientes e reguladores."
