bank,qtd_noticias_recentes,indice_bcb,total_clientes,recl_procedentes,total_respondidas,principal_motivo,periodo,resumo_insight_ia
Itaú,230,34.12,100863694.0,361.0,27703.0,Não informado no período,1ºT/2026,"🔹 O Itaú anunciou recentemente uma mudança significativa em sua política de trabalho híbrido, exigindo que os funcionários trabalhem mais dias presenciais a partir de 2028. Essa decisão foi amplamente divulgada por vários meios de comunicação, incluindo Rádio Itatiaia, CPG Click Petróleo e Gás, Folha de S.Paulo, UOL Economia, Expressão Rondônia e G1. A mudança visa aumentar a interação entre os funcionários e melhorar a produtividade, mas também gerou reações negativas por parte dos bancários, que defendem o home office como uma opção mais flexível e confortável.


🔹 A reação dos bancários à decisão do Itaú foi rápida e veementemente contrária, com muitos expressando sua insatisfação com a mudança. O Sindicato dos Bancários reforçou a defesa do home office e anunciou que entregará uma pauta de reivindicações ao Itaú em 2 de julho, conforme noticiado pelo SindicarioNET. Essa reação sugere que a decisão do Itaú pode ter um impacto negativo na reputação do banco entre seus funcionários e pode levar a negociações mais duras com o sindicato.


🔹 A decisão do Itaú de aumentar o trabalho presencial também contrasta com as ações de outros bancos, como o Banco do Brasil, que anunciou que abonará as horas dos jogos da Seleção Brasileira na Copa, conforme noticiado pelo SindicarioNET. Essa diferença de abordagem pode afetar a percepção pública do Itaú em relação a outros bancos e pode influenciar a escolha dos clientes e dos funcionários. Além disso, a mudança na política de trabalho híbrido do Itaú pode ser vista como um retrocesso em termos de flexibilidade e bem-estar dos funcionários."
Bradesco,87,48.92,110328071.0,348.0,35387.0,Não informado no período,1ºT/2026,"🔹 O Banco Bradesco enfrenta desafios legais e operacionais, com destaque para a condenação pelo TJDFT a indenizar um consumidor por cobrança indevida. Além disso, o Ministério Público instaurou um inquérito civil para apurar o atendimento do banco em Cassilândia, MS, o que pode afetar a reputação do banco em termos de serviço ao cliente. Esses eventos indicam a necessidade de melhoria nos processos internos e na gestão de reclamações para evitar danos à imagem do banco.


🔹 Em um contexto mais positivo, o Bradesco anunciou a liberação de um novo JCP (Juros sobre o Capital Próprio) de R$ 3,5 bilhões, detalhando o pagamento aos acionistas. Essa medida pode ser vista como um sinal de confiança e solidez financeira do banco, podendo atrair investidores e melhorar a percepção do mercado sobre a instituição. Além disso, a CVM revogou a suspensão de oferta pública de um fundo do Bradesco, o que também contribui para uma percepção mais favorável.


🔹 O Bradesco também tem se destacado em iniciativas de recrutamento e benefícios aos funcionários, com a abertura de centenas de vagas e discussões sobre avanços em remuneração variável, saúde e plano para aposentados. Essas ações podem melhorar a satisfação dos colaboradores e, por consequência, a experiência do cliente, uma vez que funcionários motivados e bem remunerados tendem a oferecer um melhor atendimento."
Santander,78,34.49,71632364.0,187.0,24301.0,Não informado no período,1ºT/2026,"🔹 O banco Santander promoveu um leilão com 214 oportunidades, demonstrando sua atuação no mercado financeiro e busca por diversificar suas operações. Além disso, o banco também anunciou a mudança de sua sede para o prédio da antiga Marisa, encerrando atividades no ""prédio do Banespa"", o que pode indicar uma reestruturação de suas operações e busca por eficiência.


🔹 A saída da economista-chefe Ana Paula Vescovi, após 7 anos no Santander Brasil, foi amplamente noticiada. Ela foi substituída por Sandro Sobral, que assume a área de estudos econômicos. Essa mudança pode ter impacto nas estratégias econômicas do banco e na sua visão de mercado, refletindo possíveis ajustes na direção do Santander.


🔹 O Santander também prevê um grande investimento em Inteligência Artificial (IA), com expectativa de gerar mais de 1.000 milhões em valor até 2028. Além disso, o banco anunciou que ampliará o acesso a ferramentas de IA para 185 mil colaboradores, demonstrando um compromisso com a inovação e o desenvolvimento de suas operações. Por outro lado, representantes dos funcionários do Santander entregaram minutas de reivindicações específicas ao banco, o que pode indicar tensões trabalhistas e necessidade de negociação."
Nubank,134,10.65,114737784.0,78.0,31143.0,Não informado no período,1ºT/2026,"🔹 O Nubank anunciou recentemente a liberação de uma linha de crédito extra para pagar boletos e PIX sem afetar o limite do cartão, o que pode ser visto como um movimento estratégico para aumentar a satisfação dos clientes e diferenciar-se dos concorrentes. Essa iniciativa pode ajudar a melhorar a reputação do banco, pois demonstra uma abordagem mais flexível e adaptada às necessidades dos clientes. Além disso, a medida pode contribuir para aumentar a lealdade dos clientes e atrair novos usuários para a plataforma.

 

🔹 O Nubank também foi mencionado em um contexto positivo em relação à sua atratividade para investidores globais, após uma queda de 30% em seu valor. Isso sugere que o banco ainda é visto como uma opção atraente para investidores, o que pode ser um fator importante para manter a confiança dos mercados e atrair novos investimentos. Além disso, o fato de o Nubank liderar o ranking de principalidade no Brasil pelo segundo ano consecutivo é um indicador de sua solidez e crescimento no mercado.

 

🔹 No entanto, o Nubank também enfrenta desafios, como a necessidade de provar ao mercado que a inadimplência não sairá do controle. Além disso, a instituição financeira precisa manter a confiança dos clientes, especialmente em relação a notificações e alertas, como mencionado em um artigo que discute como uma notificação errada pode abalar a confiança do consumidor. Esses são pontos importantes que o Nubank precisa gerenciar para manter uma reputação sólida e continuar crescendo no mercado."
Caixa,67,23.12,158194617.0,165.0,21753.0,Não informado no período,1ºT/2026,"🔹 O banco Caixa tem enfrentado questões relacionadas à segurança e infraestrutura em algumas de suas agências, como a notícia que relata uma agência deixando o saguão dos caixas eletrônicos às escuras durante a noite em Afogados da Ingazeira, gerando sensação de insegurança. Além disso, a instituição financeira também tem sido mencionada em contextos de parcerias e negociações, como a apuração sigilosa sobre um negócio com a Master, que teve seu acesso divulgado por uma fonte. Esses eventos podem influenciar a percepção pública sobre a gestão e a confiabilidade do banco.


🔹 A Caixa também tem se destacado por suas iniciativas de pagamento e benefícios a milhões de brasileiros, como a liberação de pagamentos de até R$ 1.621 em junho, em parceria com o Banco do Brasil. Além disso, o banco oferece opções de investimento e crédito, como o Caixa Tem, que permite aos beneficiários do Pé-de-Meia fazerem o dinheiro render mais, e a possibilidade de solicitar crédito de até R$ 800 para usuários do Caixa Tem. Essas ações podem contribuir positivamente para a reputação do banco em termos de suporte financeiro e inclusão.


🔹 No entanto, o banco também enfrenta desafios regulatórios e de gestão, como a cobrança de explicação pela área técnica do TCU sobre uma licitação de publicidade no valor de R$ 760 milhões. Além disso, o presidente do comitê de riscos da Caixa expressou preocupação sobre a renegociação de dívidas do agronegócio, considerando-a um ""duplo castigo"" para os bancos. Esses pontos indicam que o banco precisa lidar com questões complexas de conformidade e gestão de riscos para manter sua reputação e confiabilidade no mercado."
C6,5,55.3,34326775.0,371.0,7347.0,Não informado no período,1ºT/2026,"🔹 O C6 Bank foi promovido ao segmento S2 pelo Banco Central, o que significa que o banco alcançou um novo patamar de classificação e se iguala a instituições financeiras como Nubank, XP e Safra. Essa promoção é um indicador de que o C6 Bank está crescendo e se consolidando no mercado financeiro, melhorando sua reputação e confiabilidade perante os clientes e o mercado.

 

🔹 O C6 Bank anunciou uma parceria com a Azul, oferecendo até 120% de bônus nas transferências de pontos do Inter, C6 Bank e Coopera para o programa de fidelidade da companhia aérea. Essa parceria é uma estratégia para atrair e reter clientes, oferecendo benefícios exclusivos e aumentando a satisfação dos clientes com a marca.

 

🔹 O C6 Bank também anunciou o patrocínio ao surfista Yago Dora, o que demonstra a intenção do banco em se conectar com o público e apoiar esportes e atividades que são relevantes para sua base de clientes. Essa ação de marketing pode contribuir para melhorar a percepção da marca e aumentar a conexão emocional com os clientes, fortalecendo a reputação do C6 Bank no mercado."
BTG Pactual,26,42.81,27389127.0,239.0,7867.0,Não informado no período,1ºT/2026,"🔹 O BTG Pactual tem sido mencionado em várias notícias recentes, destacando-se a avaliação do banco sobre a decisão do Comitê de Política Monetária (Copom) do Banco Central, que considerou ""dovish"" (ou seja, mais branda do que o esperado), mas não altera o cenário de fim dos cortes em 2026. Além disso, o banco lançou uma nova ferramenta chamada Research Ideas, que visa conectar teses de investimento com oportunidades de negócios, demonstrando um esforço para inovar e melhorar a experiência do cliente.


 

🔹 Outro ponto de destaque é a compra do Digimais pelo BTG Pactual, que enfrenta complicações devido a uma operação da Polícia Federal (PF) que investiga fraudes no Banco Digimais, de propriedade de Edir Macedo. A operação resultou no bloqueio de R$ 670 milhões e pode ter impacto nas negociações de compra do banco. Essa situação pode afetar a reputação do BTG Pactual, especialmente se o banco for associado a práticas irregulares ou de risco.


 

🔹 Por outro lado, o BTG Pactual também recebeu uma recomendação positiva do JPMorgan, que elevou a classificação do banco para ""overweight"", indicando uma perspectiva otimista para o desempenho das ações do BTG Pactual. Além disso, o banco tem se destacado por parcerias e lançamentos de produtos inovadores, como a pesquisa Nexus/BTG sobre a eleição presidencial, demonstrando um compromisso com a inteligência de mercado e a análise de tendências."
PicPay,66,37.22,68839517.0,514.0,9459.0,Não informado no período,1ºT/2026,"🔹 O PicPay está enfrentando investigações e críticas relacionadas a descontos indevidos em folha de pagamento, com acusações de ""roubo"" do salário de servidores do DF, conforme declarado por Nelson Neto. Isso ocorre após uma operação do Ministério Público que mira a empresa, juntamente com a BRB e a Secretaria de Economia do DF, por supostas irregularidades nos descontos. Essas alegações têm impactado a reputação do PicPay e levantam questões sobre a transparência e a ética nas operações financeiras da empresa.


🔹 Além disso, o PicPay também está lidando com o impacto negativo de uma ação coletiva nos EUA, que acusa a empresa de enganar investidores. Essa ação, combinada com as investigações e críticas no Brasil, tem contribuído para a queda das ações da empresa após o IPO na Nasdaq. A situação é ainda mais complicada devido a parcerias questionáveis, como a suposta aliança entre a BRB e o PicPay, que levanta suspeitas sobre a influência política e os interesses econômicos por trás dessas parcerias.


🔹 Outro ponto de preocupação é a percepção de que o PicPay pode estar se beneficiando de regras favoráveis, como a mudança na regra de consignado no DF, que foi criticada por permitir juros extorsivos. A empresa nega qualquer fraude e afirma que não opera consignado, mas essas explicações não têm sido suficientes para acalmar as críticas e as suspeitas. A necessidade de maior regulação do sistema financeiro, como defendido pelo Sindicato dos Bancários, é um tema recorrente nas discussões sobre o PicPay e seu impacto no mercado financeiro."
Inter,13,34.86,43178240.0,167.0,8097.0,Não informado no período,1ºT/2026,"🔹 O Banco Inter tem se destacado por suas iniciativas de marketing e parcerias inovadoras, como o patrocínio do game de futebol ""7 a 0"" e a criação de uma conta no fórum do banco pelo ídolo do Atlético, Ronaldinho. Essas ações demonstram a busca do banco por se conectar com seu público-alvo de forma criativa e interativa, fortalecendo sua presença no mercado e sua reputação como uma instituição financeira inovadora.


🔹 Além disso, o Banco Inter também tem se destacado por suas análises e previsões econômicas, com seu economista-chefe afirmando que o Copom deveria manter um jogo aberto sobre juros diante das incertezas atuais. Isso mostra que o banco está atento às tendências econômicas e está disposto a compartilhar suas perspectivas com o mercado, o que pode contribuir para sua reputação como uma instituição financeira confiável e especializada.


🔹 O Banco Inter também tem investido em tecnologia e inovação, com a criação de uma plataforma de indicação para clientes e a oferta de benefícios exclusivos, como o desconto de R$ 177 na assinatura do Duo Gourmet no Dia dos Namorados. Além disso, o banco também tem uma presença significativa na IA do WhatsApp, com 18 mil pessoas interagindo com sua inteligência artificial, o que demonstra seu compromisso em oferecer serviços personalizados e acessíveis aos seus clientes."
