bank,qtd_noticias_recentes,indice_bcb,total_clientes,recl_procedentes,total_respondidas,principal_motivo,periodo,resumo_insight_ia
Itaú,38,34.12,100863694.0,361.0,27703.0,Não informado no período,1ºT/2026,"**Resumo das Notícias do Banco Itaú**

Aqui estão 3 tópicos curtos sobre as notícias do banco Itaú, focando no sentimento do cliente e temas principais:

1. **Contas Encerradas**: O Itaú encerrou as contas de Deolane Bezerra após identificar movimentações suspeitas, incluindo uma tentativa de saque de R$ 1 milhão em espécie. Isso gerou um sentimento de insatisfação e frustração entre os clientes.
2. **Processos Judiciais**: A irmã de Deolane processou o Itaú após o banco barrar o saque de R$ 1 milhão, alegando que a operação era suspeita. Isso mostra que os clientes estão dispostos a lutar por seus direitos e questionar as decisões do banco.
3. **Expansão e Oportunidades**: Em um tom mais positivo, o Itaú Unibanco anunciou a abertura de mais de 240 vagas de emprego na região sudeste do Brasil, mostrando que o banco está investindo no crescimento e no desenvolvimento de sua equipe. Isso pode gerar um sentimento de otimismo e confiança entre os clientes e os funcionários."
Bradesco,35,48.92,110328071.0,348.0,35387.0,Não informado no período,1ºT/2026,"**Resumo das Notícias do Banco Bradesco**

Aqui estão 3 tópicos curtos sobre as notícias do Banco Bradesco, focando no sentimento do cliente e temas principais:

1. **Expansão de Serviços para Clientes de Alta Renda**: O Bradesco está expandindo seus serviços para atender aos clientes de alta renda, com a oferta de financiamento de jatos executivos e lançamento de linha de crédito para aeronaves executivas.
2. **Preocupações com Condições de Trabalho e Privacidade**: O sindicato dos bancários está pressionando o Bradesco para melhorar as condições de trabalho e acabar com a exposição de ranking de funcionários, o que pode afetar o sentimento dos funcionários e, por consequência, a experiência do cliente.
3. **Desempenho Financeiro e Dividendos**: O Bradesco está anunciando dividendos de empresas como PepsiCo e Lockheed Martin, e os investidores estão monitorando o desempenho financeiro do banco, com alertas sobre a possibilidade de queda nos preços das ações."
Santander,36,34.49,71632364.0,187.0,24301.0,Não informado no período,1ºT/2026,"**Resumo das Notícias do Banco Santander**

Aqui estão 3 tópicos curtos sobre as notícias do Banco Santander, focando no sentimento do cliente e temas principais:

1. **Problemas no Atendimento**: O Banco Santander foi multado em mais de R$ 1,7 milhão por falhas no SAC (Serviço de Atendimento ao Consumidor) pelo Procon-MPMG, o que pode afetar negativamente a percepção dos clientes sobre a instituição.
2. **Recomendações de Investimento**: O Santander elevou a recomendação de compra para a Petrobras (PETR4), considerando a ação barata e com potencial de crescimento, o que pode ser visto como uma oportunidade para os investidores.
3. **Relacionamento com Funcionários e Acordos**: O banco pagou a 1ª parcela do 13º salário na folha de maio, o que é um ponto positivo para os funcionários, mas também enfrenta questionamentos sobre o ""Conduta Certo"" e outros acordos, o que pode gerar incertezas entre os clientes e funcionários."
Nubank,40,10.65,114737784.0,78.0,31143.0,Não informado no período,1ºT/2026,"**Resumo das Notícias do Nubank em 3 Tópicos**

1. **Mudanças e Regulamentação**: O Nubank passará por mudanças devido a determinações do Banco Central, o que pode afetar a experiência do cliente. Além disso, o banco está emitindo alertas sobre golpes e bloqueio de contas por dívida, demonstrando uma preocupação com a segurança e a conformidade regulatória.
2. **Inovação e Ofertas**: O Nubank continua a inovar, oferecendo benefícios como a zerar de taxas para compra de Bitcoin no Pizza Day, e investindo em estratégias de IA para melhorar a experiência do cliente. Isso mostra que o banco está comprometido em oferecer serviços inovadores e atraentes.
3. **Comunicação e Transparência**: O Nubank está se comunicando abertamente com os clientes sobre mudanças, alertas e ofertas, demonstrando uma preocupação com a transparência e a confiança. Isso é fundamental para manter a satisfação e a lealdade dos clientes, especialmente em um mercado financeiro cada vez mais competitivo."
Caixa,40,23.12,158194617.0,165.0,21753.0,Não informado no período,1ºT/2026,"**Resumo das Notícias do Banco Caixa em 3 Tópicos**

1. **Problemas Técnicos e Acesso**: Clientes relatam dificuldades para acessar suas contas no aplicativo da Caixa, gerando insatisfação e preocupação com a segurança e disponibilidade dos serviços.
2. **Negociações e Mudanças**: A Caixa está passando por mudanças e negociações, incluindo a renegociação do Desenrola Fies 2026, o que pode afetar os clientes e empregados. Além disso, há denúncias de sobrecarga e desvalorização dos empregados.
3. **Desempenho Financeiro e Expansão**: O banco apresentou um lucro contábil de R$ 3,469 bilhões no primeiro trimestre de 2026 e está expandindo sua presença com a inauguração de novas agências, como a em Conde, PB. Além disso, há oportunidades de emprego com o concurso Caixa 2025, com 736 vagas disponíveis."
C6,40,55.3,34326775.0,371.0,7347.0,Não informado no período,1ºT/2026,"Aqui estão 3 tópicos curtos sobre as notícias do banco C6, focando no sentimento do cliente e temas principais:

1. **Preocupação com segurança**: O banco C6 está enfrentando problemas relacionados à segurança dos clientes, com notícias sobre possíveis fraudes e cobranças indevidas. Isso pode gerar insegurança e desconfiança entre os clientes.
2. **Desempenho financeiro**: Apesar dos problemas, o C6 Bank apresentou um crescimento na carteira de crédito e lucro de R$ 2,46 bilhões. No entanto, a interrupção dos planos de emitir bonds pode ser um sinal de incerteza sobre o futuro do banco.
3. **Problemas com reguladores**: O banco C6 está enfrentando problemas com reguladores, incluindo multas por empréstimo consignado fraudulento e a suspensão da oferta de novos consignados pelo INSS devido a cobranças indevidas. Isso pode afetar a confiança dos clientes e a reputação do banco."
BTG Pactual,40,42.81,27389127.0,239.0,7867.0,Não informado no período,1ºT/2026,"**Resumo das Notícias do Banco BTG Pactual**

Aqui estão 3 tópicos curtos sobre as notícias do banco BTG Pactual, focando no sentimento do cliente e temas principais:

1. **Crescimento e Rentabilidade**: O BTG Pactual alcançou um recorde de lucro e receita, com um Roae de 26,6%. Isso indica que o banco está em uma posição financeira sólida e com potencial de crescimento.
2. **Integração com o Banco Pan**: A incorporação do Banco Pan foi concluída e as negociações foram unificadas na B3. Isso pode trazer benefícios para os clientes, como uma maior oferta de produtos e serviços, mas também pode gerar preocupações sobre a canibalização de serviços.
3. **Desafios e Queixas**: O BTG Pactual/Pan lidera as queixas contra bancos no 1º trimestre, o que pode indicar que os clientes estão enfrentando desafios com os serviços do banco. Além disso, a renegociação de dívidas no Desenrola 2.0 ainda não está disponível, o que pode gerar frustração entre os clientes."
PicPay,39,37.22,68839517.0,514.0,9459.0,Não informado no período,1ºT/2026,"**Resumo das Notícias do Banco PicPay**

Aqui estão 3 tópicos curtos sobre as notícias do banco PicPay, focando no sentimento do cliente e temas principais:

1. **Investigação do Cade**: O Cade (Conselho Administrativo de Defesa Econômica) está investigando a venda da seguradora do Banco Master para o PicPay devido a suspeitas de triangulação financeira. Isso pode gerar desconfiança entre os clientes.
2. **Reclamações e Compromissos**: O PicPay lidera o ranking de reclamações do Banco Central, o que pode indicar insatisfação dos clientes. No entanto, a empresa também firmou um compromisso com o INSS para devolver cerca de 1 milhão de reais cobrados indevidamente, demonstrando um esforço para resolver problemas.
3. **Desempenho e Reconhecimento**: Apesar das investigações e reclamações, o PicPay está sendo reconhecido por sua solução de pagamentos e rentabilidade, com uma cobertura de ações iniciada pela BB-BI e uma posição no Top 5 do Banco Central em projeções de inflação. Isso pode indicar que a empresa está no caminho certo em termos de desempenho financeiro."
Inter,40,34.86,43178240.0,167.0,8097.0,Não informado no período,1ºT/2026,"**Resumo das Notícias do Banco Inter**

Aqui estão 3 tópicos curtos sobre as notícias do Banco Inter, focando no sentimento do cliente e temas principais:

1. **Inovação e Ofertas**: O Banco Inter lançou uma funcionalidade para criptomoedas com taxa zero, o que pode ser visto como uma medida para atrair e reter clientes.
2. **Desempenho e Expectativas**: As ações do Banco Inter têm apresentado uma queda significativa, com alguns analistas questionando a capacidade do banco de manter um ROE (Retorno sobre o Patrimônio Líquido) de 30%. No entanto, outros analistas apostam em uma alta de até 70% nas ações.
3. **Reação e Estratégia**: O Banco Inter está reagindo à queda das ações com uma nova aposta, a ""Regra dos 50"", que visa crescer e lucrar mais até 2029. Além disso, o CEO do banco afirma que há ambidestria de poder crescer com margens boas, o que pode ser visto como um sinal de otimismo para os clientes e investidores."
