bank,qtd_noticias_recentes,indice_bcb,total_clientes,recl_procedentes,total_respondidas,principal_motivo,periodo,resumo_insight_ia
Itaú,36,34.12,100863694.0,361.0,27703.0,Não informado no período,1ºT/2026,"**Resumo das Notícias do Banco Itaú**

Aqui estão 3 tópicos curtos sobre as notícias do banco Itaú, focando no sentimento do cliente e temas principais:

1. **Cobranças Indevidas**: O Itaú admitiu cobrar indevidamente seguros por 14 anos e promete ressarcir os clientes. Isso pode gerar um sentimento de desconfiança e insatisfação entre os clientes.
2. **Multa e Ressarcimento**: O banco está sujeito a uma multa diária de R$ 10 mil se não devolver o dinheiro das cobranças indevidas. Além disso, o Itaú vai pagar R$ 3,99 bilhões a acionistas, o que pode ser visto como uma tentativa de reparar o dano causado.
3. **Repercussão no Mercado**: As notícias sobre as cobranças indevidas podem afetar a percepção dos investidores e clientes sobre o banco, mas o Itaú BBA considera que a situação não afeta a atratividade das ações na B3. No entanto, o sentimento do cliente pode ser afetado negativamente, o que pode levar a uma perda de confiança no banco."
Bradesco,30,48.92,110328071.0,348.0,35387.0,Não informado no período,1ºT/2026,"Aqui estão 3 tópicos curtos sobre as notícias do Bradesco, focando no sentimento do cliente e temas principais:

1. **Oportunidades de emprego e crescimento**: O Bradesco está oferecendo vagas de emprego em áreas de tecnologia, negócios e atendimento, o que pode ser visto como uma oportunidade para os clientes que buscam carreiras no setor financeiro.
2. **Desempenho financeiro e serviços**: O Bradesco apresentou um lucro crescente e está investindo em áreas como tecnologia e atendimento, o que pode melhorar a experiência do cliente. No entanto, houve relatos de instabilidade no Pix, o que pode afetar negativamente o sentimento do cliente.
3. **Controvérsias e responsabilidade social**: O Bradesco foi condenado a indenizar um cliente e também está envolvido em discussões sobre o alto nível de endividamento no país. Por outro lado, a instituição também está promovendo iniciativas de responsabilidade social, como palestras e mentorias para mulheres em finanças."
Santander,36,34.49,71632364.0,187.0,24301.0,Não informado no período,1ºT/2026,"**Resumo das Notícias do Banco Santander em 3 Tópicos**

1. **Pontuação e Ofertas**: O Santander Rewards ampliou a pontuação para além dos gastos no cartão de crédito, uma medida que pode agradar os clientes. No entanto, o banco deixou de oferecer cartões de crédito American Express, o que pode desapontar alguns clientes.

2. **Problemas e Indenizações**: O Santander foi condenado a indenizar um cliente que foi negativado após renegociação de dívida, o que pode afetar a confiança dos clientes na instituição. Além disso, o banco foi notificado por atraso na aposentadoria e pode pagar uma multa de R$ 260 mil.

3. **Reorganização e Parcerias**: O Santander está passando por uma reorganização e anunciou a incorporação da Esfera Fidelidade, uma subsidiária de programas de fidelidade. O banco também se tornou o gestor da folha de pagamento de 1,5 mil servidores e participou de uma operação bilionária para socorrer o BRB, o que pode indicar uma expansão de suas atividades e parcerias."
Nubank,36,10.65,114737784.0,78.0,31143.0,Não informado no período,1ºT/2026,"Aqui estão 3 tópicos curtos sobre as notícias do Nubank, focando no sentimento do cliente e temas principais:

1. **Instabilidade e problemas técnicos**: Muitos clientes do Nubank estão enfrentando dificuldades para realizar transações via Pix e acessar o aplicativo, gerando frustração e insatisfação.
2. **Dívidas e bloqueio de contas**: A notícia sobre o bloqueio de contas por ordem judicial no mesmo dia e o caso de uma dívida que cresceu 65 vezes e chegou a R$ 788 mil geram preocupação e medo entre os clientes do Nubank.
3. **Desconfiança e incerteza**: As notícias sobre a instabilidade do Nubank e a possibilidade de mudanças na empresa após decisão do Banco Central estão gerando desconfiança e incerteza entre os clientes, levantando questionamentos sobre o futuro do banco digital."
Caixa,38,23.12,158194617.0,165.0,21753.0,Não informado no período,1ºT/2026,"**Resumo das Notícias do Banco Caixa**

Aqui estão 3 tópicos curtos sobre as notícias do banco Caixa, focando no sentimento do cliente e temas principais:

1. **Concurso Caixa**: O banco está estudando a realização de um novo concurso para Técnico Bancário, o que pode abrir milhares de oportunidades para nível médio. Isso pode gerar expectativa positiva entre os candidatos e melhorar a percepção do banco como empregador.
2. **Saúde e Sobrecarga**: No entanto, os empregados do banco relatam um cenário de adoecimento devido à sobrecarga de trabalho e falta de respostas do banco sobre o tema. Isso pode afetar negativamente o sentimento dos funcionários e a imagem do banco.
3. **Parcerias e Finanças**: O banco também está envolvido em parcerias financeiras, como a busca por capitalização bilionária com apoio de outros bancos. Isso pode ser visto como um sinal de estabilidade e crescimento do banco, mas não tem impacto direto no sentimento do cliente."
C6,40,55.3,34326775.0,371.0,7347.0,Não informado no período,1ºT/2026,"Aqui estão 3 tópicos curtos sobre as notícias do banco C6, focando no sentimento do cliente e temas principais:

1. **Instabilidade no PIX**: Os clientes do C6 Bank estão reclamando de instabilidade no sistema de pagamento PIX, o que pode gerar frustração e insatisfação.
2. **Inovação com IA**: O C6 Bank está expandindo o uso de inteligência artificial (IA) para engajar clientes e melhorar a experiência, com a introdução de uma ferramenta que permite ""conversar"" com a fatura do cartão.
3. **Problemas de confiança**: O banco está enfrentando problemas de confiança, com multas por empréstimo consignado fraudulento e possíveis investigações por fraudes, o que pode afetar a percepção dos clientes sobre a instituição."
BTG Pactual,39,42.81,27389127.0,239.0,7867.0,Não informado no período,1ºT/2026,"**Resumo das Notícias do Banco BTG Pactual**

Aqui estão 3 tópicos curtos sobre as notícias do banco BTG Pactual, focando no sentimento do cliente e temas principais:

1. **Incorporação do Banco Pan**: O BTG Pactual concluiu a incorporação do Banco Pan, o que pode gerar preocupações entre os clientes sobre mudanças nos serviços e produtos oferecidos. No entanto, o CEO do BTG Pactual afirma que a rentabilidade do Banco Pan alcançará a do grupo até 2028.
2. **Crescimento e Lucro**: O BTG Pactual atingiu um recorde de lucro e receita, com um Roae de 26,6%. Isso pode ser visto como um sinal positivo para os clientes, indicando que o banco está em uma posição financeira sólida.
3. **Expansão de Serviços**: O BTG Pactual está expandindo seus serviços de varejo e consignado, o que pode ser visto como uma oportunidade para os clientes terem mais opções de produtos e serviços. Além disso, a fintech Meu Tudo, do grupo, está disputando o mercado de consignado sem canibalizar os serviços do Pan."
PicPay,40,37.22,68839517.0,514.0,9459.0,Não informado no período,1ºT/2026,"**Resumo das Notícias do Banco PicPay**

Aqui estão 3 tópicos curtos sobre as notícias do banco PicPay, focando no sentimento do cliente e temas principais:

1. **Crescimento e Expansão**: O PicPay registrou um lucro de 237% e uma receita de R$ 4,5 bilhões no semestre, marcando um período histórico para o banco digital. Além disso, a empresa liderou os ganhos em um dia positivo para as fintechs nos EUA.
2. **Conflitos e Parcerias**: O PicPay está envolvido em uma disputa com o Itaú, com o Cade abrindo investigações sobre a venda de seguradoras e a carteira digital. No entanto, a empresa também fez parceria com a TIM para oferecer serviços financeiros.
3. **Desempenho no Mercado**: O PicPay teve um desempenho misto no mercado, com uma ""upgrade"" da Moody's que não animou o mercado e uma queda de 34% em dois dias. No entanto, a empresa continua a expandir seus serviços e produtos, como o lançamento do Epic, uma aposta para a alta renda self-made."
Inter,39,34.86,43178240.0,167.0,8097.0,Não informado no período,1ºT/2026,"Aqui estão 3 tópicos curtos resumindo as notícias do Banco Inter, com foco no sentimento do cliente e temas principais:

1. **Descontentamento com remuneração de executivos**: O Banco Inter está enfrentando pressão por causa da remuneração milionária de seus executivos, o que está afetando negativamente as ações do banco e gerando descontentamento entre os investidores e clientes.
2. **Preocupação com a gestão do banco**: As notícias sobre a queda das ações do banco e a reação exagerada do mercado estão gerando preocupação entre os clientes e investidores sobre a gestão do Banco Inter e sua capacidade de lidar com desafios econômicos.
3. **Problemas de imagem e confiança**: O Banco Inter também está enfrentando problemas de imagem e confiança devido a erros, como o caso do STJ decidir que o banco deve devolver dinheiro de uma idosa, e incidentes internos, como o barulho em um elevador que causou apreensão em funcionários, o que pode afetar a confiança dos clientes no banco."
